title,description
Spirits - anis and cherry drinks,"The MOVING reference member state of this VC (Value Chain) is SPAIN UCO. The reference MOVING Card ID of this VC is VC 03 ES. In Cazalla de la Sierra there used to be around 15 destileries, but only two remain today. Its quality was once certified by a Comitee of Cazalla producers, which dissapeared with the other destilleries. Nowadays, the quality is recognised based on the history of this product and its relation with the locality, keeping the traditional making. In fact, the name of Cazalla for these kind of drinks directly reffers to the municipality of Cazalla de la Sierra that once was the main producer of anis drinks. The production of Cazalla started as a complementary industry of wine making and thanks to the wild aniseed that grows in the region. Nonetheless, the vines from the region Sierra Norte de Sevilla and the produced wines are still a growing asset, producing quality wines under a PDO label."
Mountain landscape and reference chains,"The reference mountain chain of this VC is Sierra Morena. The reference mountain landscape of this VC is Cazalla de la Sierra. This MRL is located in a mid-mountain area with a mosaic landscape that combines dense forests with dehesa and agricultural fields. Therefore, the agricultural production is diverse in the region, combining crops with low-intensity livestock. The urban settlement has historic constructions and monuments from the XV and XVI centuries. The MRL is also well known by other artisanal products such as olive oil or dry-cured meat."
Geography and population,The size of the area (km2) is 356.39. The minimum altimetry of the LAU (Local Administrative Unit) is 80. The maximum altimetry of the LAU is 763. The total population (in thousand) is unspecified. The population density (Inhabitants/km2) in the LAU is 13.14. The population change rate of the LAU in the last 10 years (%) has been -6.50%. The overall regional population density (Inhabitants/km2) is unspecified. The regional population change rate in the last 10 years (%) is unspecified.
Income and gross value added,The average per capita income (EUR/year) [Province] is 12387. The total Gross Value Added (GVA) (EUR million/year) [Province] is 35778.3. The primary sector share of total GVA/year [Province] is 5.34%. The secondary sector share of total GVA/year [Province] is 20.76%. The tertiary sector share of total GVA/year [Province] is 73.90%. The per capita income (EUR/year) [Region] is unspecified. The total Gross Value Added (GVA) (EUR million/year) [Region] is unspecified. The primary sector share of total GVA/year [Region] is unspecified. The secondary sector share of total GVA/year [Region] is unspecified. The tertiary sector share of total GVA/year [Region] is unspecified.
Tourism,The total number of bed places (BPs) in tourist accommodations/year in the LAU (Local Administrative Unit) is 0. The regional (Region) share of total BPs/year is unspecified. The number of agricultural holdings in the LAU is unspecified. The nearest settlement with population over 100000 (km) is 77.7. In this region protected areas are present.
Employment,The primary sector share of total employment/year [Province] is 5.90%. The secondary sector share of total employment/year [Province] is 17.40%. The tertiary sector share of total employment/year [Province] is 76.70%. The primary sector share of total employment/year [Region] is unspecified. The secondary sector share of total employment/year [Region] is unspecified. The tertiary sector share of total employment/year [Region] is unspecified.
Interest on this VC,"High quality product with old tradition in the area. The important wine production that Cazalla de la Sierra had during the 15th and 16th centuries, resulted in the distillation of the leftovers in order to obtain the alcohol with which this drink began to be manufactured. Today there is a museum in the area to explore the history behind the local wines and spirits. The new product was the introduction of the cherry in the anis drinks. The marketing strategy is linked to the e-commerce."
Challenges,Survive in a time when the consumption of anis and cherry drinks is less popular. Overall the type of challenge faced by this VC is Current. This VC is classified as Traditional and Innovative.
Innovation,The type of innovation of this VC (Value Chain) is Endogenous and Exogenous. There are two kinds of innovation. One occurred years ago with the introduction of cherries into the production system to make a new drink. The other is the e-commerce. The innovation is related to New products and New marketing strategies. The land use systems involved are Cropland. The local assets include Natural and cultural.
