title,description
'AlpenPionier' hemp products,"The MOVING reference member state of this VC (Value Chain) is SWITZERLAND 1. The reference MOVING Card ID of this VC is VC 25 CH1. Hemp was commonly produced in the mountains until the 1930s. The young label 'AlpenPionier' aspires to revive alpine hemp production in Grisons with an array of products such as hemp nuts, bars, tea, beer, oil, pasta or hemp powder, which are prescribed to be very healthy and contain a lot of protein. The products are marketed through farm shops, an online shop and some bigger retailers all over Switzerland."
Mountain landscape and reference chains,The reference mountain chain of this VC is unspecified. The reference mountain landscape of this VC is unspecified.
Geography and population,The size of the area (km2) is unspecified. The minimum altimetry of the LAU (Local Administrative Unit) is unspecified. The maximum altimetry of the LAU is unspecified. The total population (in thousand) is unspecified. The population density (Inhabitants/km2) in the LAU is unspecified. The population change rate of the LAU in the last 10 years (%) is unspecified. The overall regional population density (Inhabitants/km2) is unspecified. The regional population change rate in the last 10 years (%) is unspecified.
Income and gross value added,The average per capita income (EUR/year) [Province] is unspecified. The total Gross Value Added (GVA) (EUR million/year) [Province] is unspecified. The primary sector share of total GVA/year [Province] is unspecified. The secondary sector share of total GVA/year [Province] is unspecified. The tertiary sector share of total GVA/year [Province] is unspecified. The per capita income (EUR/year) [Region] is unspecified. The total Gross Value Added (GVA) (EUR million/year) [Region] is unspecified. The primary sector share of total GVA/year [Region] is unspecified. The secondary sector share of total GVA/year [Region] is unspecified. The tertiary sector share of total GVA/year [Region] is unspecified.
Tourism,The total number of bed places (BPs) in tourist accommodations/year in the LAU (Local Administrative Unit) is unspecified. The regional (Region) share of total BPs/year is unspecified. The number of agricultural holdings in the LAU is unspecified. The nearest settlement with population over 100000 (km) is unspecified.
Employment,The primary sector share of total employment/year [Province] is unspecified. The secondary sector share of total employment/year [Province] is unspecified. The tertiary sector share of total employment/year [Province] is unspecified. The primary sector share of total employment/year [Region] is unspecified. The secondary sector share of total employment/year [Region] is unspecified. The tertiary sector share of total employment/year [Region] is unspecified.
Interest on this VC,"innovative way of re-introducing an old craft, led by young, well connected people. innovative way of re-introducing an old craft, led by young, well connected people."
Challenges,"very specific, niche. Overall the type of challenge faced by this VC is Predicted. This VC is classified as Traditional and Innovative."
Innovation,"The type of innovation of this VC (Value Chain) is Endogenous. reintroduciton of hemp production and products, products targeted at a modern audience. The innovation is related to New products and New marketing strategies. The land use systems involved are Cropland. The local assets include Natural, social and cultural."
