title,description
Anea (Bulrush) handcraft chairs and baskets,"The MOVING reference member state of this VC (Value Chain) is SPAIN UCO. The reference MOVING Card ID of this VC is VC 46 ES. The key activities are the harvest of the Bulrush, and the artisan work with it; first to prepare the material and then to build the chairs and baskets. As a natural product it is quite sustainable as it grows naturally in the region and in other river basins of the country. The production is carried out by individual artisans that learnt the method from their parents."
Mountain landscape and reference chains,"The reference mountain chain of this VC is Sierra Morena. The reference mountain landscape of this VC is Galaroza. The MRL is located at the core of the Sierra de Aracena y Picos de Aroche Natural Park. Its main production is wood furniture. The region is covered by a dense mediterranean forest and dehesas. In the higher areas, the holm oaks are substituted by the cork oaks and then by the pyrenean oaks and chesnut trees. The area has high precipitation rates with mild temperatures."
Geography and population,The size of the area (km2) is 22.31. The minimum altimetry of the LAU (Local Administrative Unit) is 490. The maximum altimetry of the LAU is 830. The total population (in thousand) is unspecified. The population density (Inhabitants/km2) in the LAU is 61.95. The population change rate of the LAU in the last 10 years (%) has been -13.90%. The overall regional population density (Inhabitants/km2) is unspecified. The regional population change rate in the last 10 years (%) is unspecified.
Income and gross value added,The average per capita income (EUR/year) [Province] is 9572. The total Gross Value Added (GVA) (EUR million/year) [Province] is 9599.3. The primary sector share of total GVA/year [Province] is 8.33%. The secondary sector share of total GVA/year [Province] is 27.46%. The tertiary sector share of total GVA/year [Province] is 64.21%. The per capita income (EUR/year) [Region] is unspecified. The total Gross Value Added (GVA) (EUR million/year) [Region] is unspecified. The primary sector share of total GVA/year [Region] is unspecified. The secondary sector share of total GVA/year [Region] is unspecified. The tertiary sector share of total GVA/year [Region] is unspecified.
Tourism,The total number of bed places (BPs) in tourist accommodations/year in the LAU (Local Administrative Unit) is 16. The regional (Region) share of total BPs/year is unspecified. The number of agricultural holdings in the LAU is unspecified. The nearest settlement with population over 100000 (km) is 98.6. In this region protected areas are present.
Employment,The primary sector share of total employment/year [Province] is 17.30%. The secondary sector share of total employment/year [Province] is 13.90%. The tertiary sector share of total employment/year [Province] is 68.80%. The primary sector share of total employment/year [Region] is unspecified. The secondary sector share of total employment/year [Region] is unspecified. The tertiary sector share of total employment/year [Region] is unspecified.
Interest on this VC,"This VC is connected with natural resources of the region, the bulrush. This is a traditional VC that once was very popular and now is under threat of extintion."
Challenges,Abandonment of traditional craftsmanship with the associated loss of knowledge. The challenge is to energise this activity and develop it to be sustainable in our times. Otherwise it will dissapear. Overall the type of challenge faced by this VC is Current. This VC is classified as Traditional.
Innovation,The type of innovation of this VC (Value Chain) is unspecified. The innovation is related to the whole VC. The land use systems involved are Natural land. The local assets include Natural and cultural.
