title,description,objects,objectlinks,wikidata_descriptions,wikidata_images,wikidata_coords
Herb liquers,"The MOVING reference member state of this VC (Value Chain) is CZECH REPUBLIC. The reference MOVING Card ID of this VC is VC 10 CZ. Herb liquers are not a mainstream product. The producers operate on a niche market. The producers do not have to be located in the region, but mostly they are. The herb liquers are used for the promotion of the regions identity. Herb liquers are sold through eshops, farmers markets, direct selling or other specialized shops.","Czech Republic, Moving (film), Value chain, Herb, E-commerce, Farmers market, Region","http://www.wikidata.org/entity/Q213, http://www.wikidata.org/entity/Q1047402, http://www.wikidata.org/entity/Q646107, http://www.wikidata.org/entity/Q207123, http://www.wikidata.org/entity/Q484847, http://www.wikidata.org/entity/Q1522620, http://www.wikidata.org/entity/Q82794","country in Central Europe|Wikimedia disambiguation page|functions of a company affecting its costs and quality and give it a competitive advantage|plant part used for flavoring, food, medicine, or perfume|type of business industry usually conducted over the Internet|market featuring foods sold directly by farmers to consumers|2D or 3D defined space on something, mainly in terrestrial and astrophysics sciences","https://upload.wikimedia.org/wikipedia/commons/5/57/Czechia_Montage.jpg,null,null,https://upload.wikimedia.org/wikipedia/commons/f/fe/K%C3%BCchenkr%C3%A4uter-1.jpg,null,https://upload.wikimedia.org/wikipedia/commons/1/12/March%C3%A9_de_producteurs_%C3%A0_Apt_2.jpg,https://upload.wikimedia.org/wikipedia/commons/7/7d/Mediterranian_Sea_Carthago_location.JPG","50 15,null,null,null,null,null,null"
Mountain landscape and reference chains,"The reference mountain chain of this VC is Giant Mountains. The reference mountain landscape of this VC is LAU 1 Trutnov. LAU 1 - Trutnov is the largest district within the NUTS 3 Kralovehradecky. The landscape of the region is very diverse with large differences in altitude. Such landscape makes the region less favorable for agricultural activities. 43,2% of the region covers agricultural land. Approximately a half of the agricultural land is arable land (53%). There is also a high share of perennial grassland in the region (41,6%). Forest land covers 46,9% of the region and this is the highest share within the NUTS2. The region includes the highest mountains of the Czech Republic (Giant Mountains) with the highest peak 1602 meters above s.l. The area of the mountains inlcude the National Park (with 385 km2).","Trutnov, Czech Republic, Giant Mountains, Trutnov District, Hradec Králové Region, National park","http://www.wikidata.org/entity/Q320950, http://www.wikidata.org/entity/Q213, http://www.wikidata.org/entity/Q214644, http://www.wikidata.org/entity/Q517734, http://www.wikidata.org/entity/Q193295, http://www.wikidata.org/entity/Q46169",town in Czechia|country in Central Europe|Czech and Polish mountain range|district of the Czech Republic|region of the Czech Republic|park used for conservation purposes of animal life and plants,"https://upload.wikimedia.org/wikipedia/commons/f/f9/Trutnov_Krakono%C5%A1ovo_n%C3%A1m%C4%9Bst%C3%AD.jpg,https://upload.wikimedia.org/wikipedia/commons/5/57/Czechia_Montage.jpg,https://upload.wikimedia.org/wikipedia/commons/1/11/Sn%C4%9B%C5%BEka_a_Ob%C5%99%C3%AD_d%C5%AFl.jpg,https://upload.wikimedia.org/wikipedia/commons/f/f9/Trutnov_Krakono%C5%A1ovo_n%C3%A1m%C4%9Bst%C3%AD.jpg,https://upload.wikimedia.org/wikipedia/commons/c/c8/Hradec_Kr%C3%A1lov%C3%A9_od_soutoku.JPG,https://upload.wikimedia.org/wikipedia/commons/5/5a/Grand_prismatic_no_noise_reduction.jpg","50.561045737535 15.912798547953,50 15,50.75 15.583333,50.560833333333 15.912777777778,50.4 15.8,null"
Geography and population,The size of the area (km2) is 1146.78. The minimum altimetry of the LAU (Local Administrative Unit) is 263. The maximum altimetry of the LAU is 1603. The total population (in thousand) is 117.978. The population density (Inhabitants/km2) in the LAU is 102.87. The population change rate of the LAU in the last 10 years (%) has been -1.84%. The overall regional population density (Inhabitants/km2) is 121.79. The regional population change rate in the last 10 years (%) has been 0.44%.,"Lau Islands, Square kilometre, Altitude, Local Administrative Unit, Population, Population density, Region, Year","http://www.wikidata.org/entity/Q1062438, http://www.wikidata.org/entity/Q712226, http://www.wikidata.org/entity/Q190200, http://www.wikidata.org/entity/Q193083, http://www.wikidata.org/entity/Q175385, http://www.wikidata.org/entity/Q22856, http://www.wikidata.org/entity/Q82794, http://www.wikidata.org/entity/Q577","archipelago of Fiji|decimal multiple of the SI unit of surface area|height in relation to a certain reference point|geocode standard for referencing the subdivisions of countries for statistical purposes|Wikimedia disambiguation page|measurement of population per unit area or unit volume|2D or 3D defined space on something, mainly in terrestrial and astrophysics sciences|the orbital period of the Earth: the estimated period of time for the Earth's orbit around the Sun and observed at a fixed geographic point (averaging 365.24 days); base later modified to define or adjust various calendars","https://upload.wikimedia.org/wikipedia/commons/6/6b/Lau_Islands_Yagasa_highres_STS098.jpg,https://upload.wikimedia.org/wikipedia/commons/1/19/1_km2.svg,https://upload.wikimedia.org/wikipedia/commons/9/9f/Altitude_marker%2C_Lismore.jpg,null,null,https://upload.wikimedia.org/wikipedia/commons/4/4d/World_population_density_map.PNG,https://upload.wikimedia.org/wikipedia/commons/7/7d/Mediterranian_Sea_Carthago_location.JPG,https://upload.wikimedia.org/wikipedia/commons/8/8c/Analemma_fishburn.tif","-17.833333333333 178.66666666667,null,null,null,null,null,null,null"
Income and gross value added,The average per capita income (EUR/year) [Province] is 10130.69. The total Gross Value Added (GVA) (EUR million/year) [Province] is 9173.35. The primary sector share of total GVA/year [Province] is 4.50%. The secondary sector share of total GVA/year [Province] is 40.50%. The tertiary sector share of total GVA/year [Province] is 55.10%. The per capita income (EUR/year) [Region] is 9762.62. The total Gross Value Added (GVA) (EUR million/year) [Region] is 23148.69. The primary sector share of total GVA/year [Region] is 3.29%. The secondary sector share of total GVA/year [Region] is 46.85%. The tertiary sector share of total GVA/year [Region] is 49.90%.,"Per capita income, Gross value added, Primary sector, Secondary sector, Tertiary sector, Region, Province","http://www.wikidata.org/entity/Q45918, http://www.wikidata.org/entity/Q994873, http://www.wikidata.org/entity/Q55640, http://www.wikidata.org/entity/Q55639, http://www.wikidata.org/entity/Q55638, http://www.wikidata.org/entity/Q82794, http://www.wikidata.org/entity/Q34876","average income of an economy|economic indicator which adjusts gross domestic product (GDP) by the impact of subsidies and taxes (tariffs) on products|includes farming, fishing & mining|industries that produce a finished, usable product or are involved in construction|service sector, as opposed to raw materials & manufacturing|2D or 3D defined space on something, mainly in terrestrial and astrophysics sciences|administrative division in several countries","null,null,null,https://upload.wikimedia.org/wikipedia/commons/a/ac/The_woman_making_a_carpet_and_watching_TV_series.jpg,https://upload.wikimedia.org/wikipedia/commons/c/c6/US_Navy_030515-N-5862D-038_U.S._Navy_recruits_get_their_first_military_haircuts_at_the_Navy_Exchange_barbershop.jpg,https://upload.wikimedia.org/wikipedia/commons/7/7d/Mediterranian_Sea_Carthago_location.JPG,https://upload.wikimedia.org/wikipedia/commons/9/97/Map_of_country_subdivisions_%28provinces%29.svg","null,null,null,null,null,null,null"
Tourism,The total number of bed places (BPs) in tourist accommodations/year in the LAU (Local Administrative Unit) is 55419. The regional (Region) share of total BPs/year is 0.45%. The number of agricultural holdings in the LAU is 1759. The nearest settlement with population over 100000 (km) is 100. In this region protected areas are present.,"Hotel room, Tourism, Local Administrative Unit, Region, Agricultural holding, Settlement, Population, Protected area","http://www.wikidata.org/entity/Q27686, http://www.wikidata.org/entity/Q49389, http://www.wikidata.org/entity/Q193083, http://www.wikidata.org/entity/Q82794, http://www.wikidata.org/entity/Q131596, http://www.wikidata.org/entity/Q1247845, http://www.wikidata.org/entity/Q175385, http://www.wikidata.org/entity/Q473972","business enterprise that provides indoor lodging in a single location paid on a short-term basis|travel for pleasure or business|geocode standard for referencing the subdivisions of countries for statistical purposes|2D or 3D defined space on something, mainly in terrestrial and astrophysics sciences|area of land for farming, or, for aquaculture, lake, river or sea, including various structures|Wikimedia disambiguation page|Wikimedia disambiguation page|areas protected for having ecological or cultural importance","https://upload.wikimedia.org/wikipedia/commons/9/98/PNY_Exterior_with_Rolls_Royce.jpg,https://upload.wikimedia.org/wikipedia/commons/b/b9/Tourism.png,null,https://upload.wikimedia.org/wikipedia/commons/7/7d/Mediterranian_Sea_Carthago_location.JPG,https://upload.wikimedia.org/wikipedia/commons/7/70/Borgboda2006_web.jpg,null,null,https://upload.wikimedia.org/wikipedia/commons/d/df/%D0%A1%D1%82%D1%96%D0%BB%D1%8C%D1%81%D1%8C%D0%BA%D0%B5_%D0%93%D0%BE%D1%80%D0%BE%D0%B4%D0%B8%D1%89%D0%B5%2C_%D0%B2%D0%B8%D0%B3%D0%BB%D1%8F%D0%B4_%D0%B7_%D0%B2%D1%83%D0%BB._%D0%97%D0%B0%D1%80%D1%96%D1%87%D0%BD%D0%BE%D1%97_2.jpg","null,null,null,null,null,null,null,null"
Employment,The primary sector share of total employment/year [Province] is 5.41%. The secondary sector share of total employment/year [Province] is 39.27%. The tertiary sector share of total employment/year [Province] is 55.33%. The primary sector share of total employment/year [Region] is 3.80%. The secondary sector share of total employment/year [Region] is 59.94%. The tertiary sector share of total employment/year [Region] is 36.26%.,"Primary sector of the economy, Secondary sector of the economy, Tertiary sector of the economy, Employment, Province, Region","http://www.wikidata.org/entity/Q55640, http://www.wikidata.org/entity/Q55639, http://www.wikidata.org/entity/Q55638, http://www.wikidata.org/entity/Q656365, http://www.wikidata.org/entity/Q34876, http://www.wikidata.org/entity/Q82794","includes farming, fishing & mining|industries that produce a finished, usable product or are involved in construction|service sector, as opposed to raw materials & manufacturing|gainful occupation|administrative division in several countries|2D or 3D defined space on something, mainly in terrestrial and astrophysics sciences","null,https://upload.wikimedia.org/wikipedia/commons/a/ac/The_woman_making_a_carpet_and_watching_TV_series.jpg,https://upload.wikimedia.org/wikipedia/commons/c/c6/US_Navy_030515-N-5862D-038_U.S._Navy_recruits_get_their_first_military_haircuts_at_the_Navy_Exchange_barbershop.jpg,https://upload.wikimedia.org/wikipedia/commons/5/59/Government_employment_as_%25_of_total_employment_in_EU.jpg,https://upload.wikimedia.org/wikipedia/commons/9/97/Map_of_country_subdivisions_%28provinces%29.svg,https://upload.wikimedia.org/wikipedia/commons/7/7d/Mediterranian_Sea_Carthago_location.JPG","null,null,null,null,null,null"
Interest on this VC,"The VC aims on production of herb liquers of various flavours. The liquers are presented as a regional product. The VC is utilizes symbolic assets of the region. Alhough this product is not unique of mountain regions, it is a great example of utilizing natural and symbolic values associated with the region. In order to generate an unique selling proposition, the liquers are often marketing as a special regional product.","Venture capital, Liqueur, Flavour, Region, Marketing, Product, Mountain range, Natural environment, Symbol","http://www.wikidata.org/entity/Q219409, http://www.wikidata.org/entity/Q178780, http://www.wikidata.org/entity/Q253463, http://www.wikidata.org/entity/Q82794, http://www.wikidata.org/entity/Q39809, http://www.wikidata.org/entity/Q1796457, http://www.wikidata.org/entity/Q46831, http://www.wikidata.org/entity/Q43619, http://www.wikidata.org/entity/Q80071","form of private equity financing that is provided by venture capital firms or funds to startups, early-stage, and emerging companies that have been deemed to have high growth potential or demonstrated high growth|alcoholic beverage, sweetened and flavored distilled spirit|Wikimedia disambiguation page|2D or 3D defined space on something, mainly in terrestrial and astrophysics sciences|study and process of promoting, distributing, and selling products or services to customers|Wikimedia disambiguation page|geographic area containing several geologically related mountains|all living and non-living things occurring naturally on Earth or some region thereof|something that represents an idea, a process, or a physical entity due to convention or association","null,https://upload.wikimedia.org/wikipedia/commons/4/43/Homemade_strawberry_liqueur.jpg,null,https://upload.wikimedia.org/wikipedia/commons/7/7d/Mediterranian_Sea_Carthago_location.JPG,null,null,https://upload.wikimedia.org/wikipedia/commons/7/79/Himalayas.jpg,https://upload.wikimedia.org/wikipedia/commons/3/36/Hopetoun_falls.jpg,https://upload.wikimedia.org/wikipedia/commons/3/38/ReligijneSymbole.svg","null,null,null,null,null,null,null,null,null"
Key local assets,"More important than the natural assets (that can be fairly easily substituted) is the social construction of quality that is used in marketing. For this purpose the producers refer to traditional knowledge embedded in the region, their product labels refer to cultural traits associated with the mountain area. The symbolic value refering to the mountains is what distingusihes the product from other similar products. ","Marketing, Traditional knowledge, Cultural trait, Mountain","http://www.wikidata.org/entity/Q39809, http://www.wikidata.org/entity/Q1428168, http://www.wikidata.org/entity/Q7552789, http://www.wikidata.org/entity/Q8502","study and process of promoting, distributing, and selling products or services to customers|knowledge systems in the cultural traditions of communities|Single identifiable element within culture|large natural elevation of the Earth's surface","null,https://upload.wikimedia.org/wikipedia/commons/3/3f/Wild_rice_harvesting_19th_century.jpg,null,https://upload.wikimedia.org/wikipedia/commons/2/29/Himalayas%2C_Ama_Dablam%2C_Nepal.jpg","null,null,null,null"
Challenges,Herb liquers are sold on mainstream food markets that are highly competetive. Main challenge for the given VC is associated with valorization of the product and with a marketing strategy. Overall the type of challenge faced by this VC is Current. This VC is classified as Traditional.,"Liqueur, Venture capital, Marketing strategy, Tradition, Present","http://www.wikidata.org/entity/Q178780, http://www.wikidata.org/entity/Q219409, http://www.wikidata.org/entity/Q1363963, http://www.wikidata.org/entity/Q82821, http://www.wikidata.org/entity/Q193168","alcoholic beverage, sweetened and flavored distilled spirit|form of private equity financing that is provided by venture capital firms or funds to startups, early-stage, and emerging companies that have been deemed to have high growth potential or demonstrated high growth|business strategy for marketing and advertising|custom passed down through generations|period of time occurring now","https://upload.wikimedia.org/wikipedia/commons/4/43/Homemade_strawberry_liqueur.jpg,null,https://upload.wikimedia.org/wikipedia/commons/7/78/Extremates.png,https://upload.wikimedia.org/wikipedia/commons/4/47/Dreschen_mit_Flegel.jpg,null","null,null,null,null,null"
Innovation,The type of innovation of this VC (Value Chain) is unspecified. The innovation is related to the whole VC. The land use systems involved are Natural land. The local assets include Natural and cultural.,"Value chain, Land use, Natural environment, Culture","http://www.wikidata.org/entity/Q646107, http://www.wikidata.org/entity/Q1165944, http://www.wikidata.org/entity/Q43619, http://www.wikidata.org/entity/Q11042",functions of a company affecting its costs and quality and give it a competitive advantage|characterization of land based on what can be built on it and what the land can be used for|all living and non-living things occurring naturally on Earth or some region thereof|shared aspects of a society's way of life,"null,null,https://upload.wikimedia.org/wikipedia/commons/3/36/Hopetoun_falls.jpg,https://upload.wikimedia.org/wikipedia/commons/8/82/Nwodua_wulana_Alhassan.jpg","null,null,null,null"
Concluding remarks,"The VC is not so important in terms of the use of natural (tangible) resources, but it is a typical example of the VC that is embedded in mountain region.","Venture capital, Natural resource, Mountain","http://www.wikidata.org/entity/Q219409, http://www.wikidata.org/entity/Q188460, http://www.wikidata.org/entity/Q8502","form of private equity financing that is provided by venture capital firms or funds to startups, early-stage, and emerging companies that have been deemed to have high growth potential or demonstrated high growth|naturally occurring resource, including mineral resources (e.g. metal ores), mined fossil fuels (e.g. petroleum), water resources (e.g. lakes and groundwater), water energy resources, timber, arable land, game (e.g. deer), fish in water bodies, etc.|large natural elevation of the Earth's surface","null,https://upload.wikimedia.org/wikipedia/commons/b/b0/Tussen_Twist_en_Nieuw_Schoonebeek%2C_Alte_en_Neue_Energie_foto5_2016-09-25_14.29.jpg,https://upload.wikimedia.org/wikipedia/commons/2/29/Himalayas%2C_Ama_Dablam%2C_Nepal.jpg","null,null,null"
