title,description,objects,objectlinks,wikidata_descriptions,wikidata_images,wikidata_coords
Pirot hard cheese from sheep and cow milk,"The MOVING reference member state of this VC (Value Chain) is SERBIA. The reference MOVING Card ID of this VC is VC 10 SER. The VC is dominated by the production of single dairy, Secondary dairy school in Pirot that is the guardian of the tradition and know how. There are around 13000 sheep produced by small scale farmers and the main milking season is May to October, while the rest of the year entails more use of cow milk in the cheese composition. The Dairy school is selling directly to consumers, through own shop to local market and through retail network. There is little readiness for further innovation in this moment, and the initiative to work on furhter quality distinction between PDO cheese are not taken yet.","Pirot, Serbia, Value chain, Sheep, Cow, Cheese, Protected Designation of Origin","http://www.wikidata.org/entity/Q309343, http://www.wikidata.org/entity/Q403, http://www.wikidata.org/entity/Q646107, http://www.wikidata.org/entity/Q7368, http://www.wikidata.org/entity/Q830, http://www.wikidata.org/entity/Q10943, http://www.wikidata.org/entity/Q13439060","city in Serbia|country in Southeast Europe|functions of a company affecting its costs and quality and give it a competitive advantage|domesticated ruminant bred for meat, wool, and milk|large, domesticated, cloven-hooved herbivores|yellow or white, creamy or solid food made from the pressed curds of milk|quality policy of the European Union for food","https://upload.wikimedia.org/wikipedia/commons/a/ac/Pirot_-_Crveni_trg_nocu.jpg,null,null,https://upload.wikimedia.org/wikipedia/commons/2/2c/Flock_of_sheep.jpg,https://upload.wikimedia.org/wikipedia/commons/4/40/Bulgarian_gray_cattle.jpg,https://upload.wikimedia.org/wikipedia/commons/f/f2/Hartkaese_HardCheeses.jpg,https://upload.wikimedia.org/wikipedia/commons/9/9e/2023_Oliwa_z_oliwek_Garda_DOP_%282%29.jpg","43.151944444444 22.585,43.95 20.933333333333,null,null,null,null,null"
Mountain landscape and reference chains,"The reference mountain chain of this VC is Eastern Serbia, Balkan mountains region. The reference mountain landscape of this VC is Balkan mountains. Pirot area is part of the of the Stara Planina National park and area of great natural value. Specific traits of traditional manufacturing of Pirot kachkaval derive from climatic conditions, characteristic grass habitat and the specific mountain region and milk from autochthonous populations (Pirot sheep). There is strong pressure of touristic investments and use of waterstreams that put pressures on enviornmental values. Traditinal know how and skills are embedded in the production process.","Balkan Mountains, Pirot, Pirin National Park, Pirin, Eastern Serbia","http://www.wikidata.org/entity/Q170427, http://www.wikidata.org/entity/Q309343, http://www.wikidata.org/entity/Q651314, http://www.wikidata.org/entity/Q726158, http://www.wikidata.org/entity/Q25469408",mountain range in the eastern part of the Balkan Peninsula|city in Serbia|national park in Bulgaria|mountain range in southwestern Bulgaria|Wikimedia disambiguation page,"https://upload.wikimedia.org/wikipedia/commons/7/7a/Balkangebirge_Balkan_topo_de.jpg,https://upload.wikimedia.org/wikipedia/commons/a/ac/Pirot_-_Crveni_trg_nocu.jpg,https://upload.wikimedia.org/wikipedia/commons/3/38/Bansko_ski_2025_28.jpg,https://upload.wikimedia.org/wikipedia/commons/8/86/Vihren_Pirin_IMG_0553.jpg,null","42.78421 24.97626,43.151944444444 22.585,41.672222222222224 23.48777777777778,41.777777777778 23.4,null"
Geography and population,The size of the area (km2) is 1232. The minimum altimetry of the LAU (Local Administrative Unit) is 368. The maximum altimetry of the LAU is 2169. The total population (in thousand) is 53.80. The population density (Inhabitants/km2) in the LAU is 44.00. The population change rate of the LAU in the last 10 years (%) has been -6.71%. The overall regional population density (Inhabitants/km2) is 30. The regional population change rate in the last 10 years (%) has been -7.15%.,"Lau Islands, Square kilometre, Altitude, Local Administrative Unit, Population, Population density, Region","http://www.wikidata.org/entity/Q1062438, http://www.wikidata.org/entity/Q712226, http://www.wikidata.org/entity/Q190200, http://www.wikidata.org/entity/Q193083, http://www.wikidata.org/entity/Q175385, http://www.wikidata.org/entity/Q22856, http://www.wikidata.org/entity/Q82794","archipelago of Fiji|decimal multiple of the SI unit of surface area|height in relation to a certain reference point|geocode standard for referencing the subdivisions of countries for statistical purposes|Wikimedia disambiguation page|measurement of population per unit area or unit volume|2D or 3D defined space on something, mainly in terrestrial and astrophysics sciences","https://upload.wikimedia.org/wikipedia/commons/6/6b/Lau_Islands_Yagasa_highres_STS098.jpg,https://upload.wikimedia.org/wikipedia/commons/1/19/1_km2.svg,https://upload.wikimedia.org/wikipedia/commons/9/9f/Altitude_marker%2C_Lismore.jpg,null,null,https://upload.wikimedia.org/wikipedia/commons/4/4d/World_population_density_map.PNG,https://upload.wikimedia.org/wikipedia/commons/7/7d/Mediterranian_Sea_Carthago_location.JPG","-17.833333333333 178.66666666667,null,null,null,null,null,null"
Income and gross value added,The average per capita income (EUR/year) [Province] is unspecified. The total Gross Value Added (GVA) (EUR million/year) [Province] is 370.47. The primary sector share of total GVA/year [Province] is 5.60%. The secondary sector share of total GVA/year [Province] is 58.45%. The tertiary sector share of total GVA/year [Province] is 35.95%. The per capita income (EUR/year) [Region] is 529.61. The total Gross Value Added (GVA) (EUR million/year) [Region] is 5202.34. The primary sector share of total GVA/year [Region] is 7.56%. The secondary sector share of total GVA/year [Region] is 41.13%. The tertiary sector share of total GVA/year [Region] is 51.31%.,"Deutsche Mark, Per capita income, Gross value added, Primary sector, Secondary sector, Tertiary sector, Region, Province","http://www.wikidata.org/entity/Q16068, http://www.wikidata.org/entity/Q45918, http://www.wikidata.org/entity/Q994873, http://www.wikidata.org/entity/Q55640, http://www.wikidata.org/entity/Q55639, http://www.wikidata.org/entity/Q55638, http://www.wikidata.org/entity/Q82794, http://www.wikidata.org/entity/Q34876","official currency of West Germany and later Germany from 1948 to 2002|average income of an economy|economic indicator which adjusts gross domestic product (GDP) by the impact of subsidies and taxes (tariffs) on products|includes farming, fishing & mining|industries that produce a finished, usable product or are involved in construction|service sector, as opposed to raw materials & manufacturing|2D or 3D defined space on something, mainly in terrestrial and astrophysics sciences|administrative division in several countries","https://upload.wikimedia.org/wikipedia/commons/b/b8/1_mark_brd_1967_retouched.jpg,null,null,null,https://upload.wikimedia.org/wikipedia/commons/a/ac/The_woman_making_a_carpet_and_watching_TV_series.jpg,https://upload.wikimedia.org/wikipedia/commons/c/c6/US_Navy_030515-N-5862D-038_U.S._Navy_recruits_get_their_first_military_haircuts_at_the_Navy_Exchange_barbershop.jpg,https://upload.wikimedia.org/wikipedia/commons/7/7d/Mediterranian_Sea_Carthago_location.JPG,https://upload.wikimedia.org/wikipedia/commons/9/97/Map_of_country_subdivisions_%28provinces%29.svg","null,null,null,null,null,null,null,null"
Tourism,The total number of bed places (BPs) in tourist accommodations/year in the LAU (Local Administrative Unit) is 78618. The regional (Region) share of total BPs/year is unspecified. The number of agricultural holdings in the LAU is 4557. The nearest settlement with population over 100000 (km) is 75. In this region protected areas are present.,"Lau Islands, Hotel room, Tourism, Local Administrative Unit, Agricultural holding, Settlement, Population, Protected area, Region","http://www.wikidata.org/entity/Q1062438, http://www.wikidata.org/entity/Q27686, http://www.wikidata.org/entity/Q49389, http://www.wikidata.org/entity/Q193083, http://www.wikidata.org/entity/Q131596, http://www.wikidata.org/entity/Q1247845, http://www.wikidata.org/entity/Q175385, http://www.wikidata.org/entity/Q473972, http://www.wikidata.org/entity/Q82794","archipelago of Fiji|business enterprise that provides indoor lodging in a single location paid on a short-term basis|travel for pleasure or business|geocode standard for referencing the subdivisions of countries for statistical purposes|area of land for farming, or, for aquaculture, lake, river or sea, including various structures|Wikimedia disambiguation page|Wikimedia disambiguation page|areas protected for having ecological or cultural importance|2D or 3D defined space on something, mainly in terrestrial and astrophysics sciences","https://upload.wikimedia.org/wikipedia/commons/6/6b/Lau_Islands_Yagasa_highres_STS098.jpg,https://upload.wikimedia.org/wikipedia/commons/9/98/PNY_Exterior_with_Rolls_Royce.jpg,https://upload.wikimedia.org/wikipedia/commons/b/b9/Tourism.png,null,https://upload.wikimedia.org/wikipedia/commons/7/70/Borgboda2006_web.jpg,null,null,https://upload.wikimedia.org/wikipedia/commons/d/df/%D0%A1%D1%82%D1%96%D0%BB%D1%8C%D1%81%D1%8C%D0%BA%D0%B5_%D0%93%D0%BE%D1%80%D0%BE%D0%B4%D0%B8%D1%89%D0%B5%2C_%D0%B2%D0%B8%D0%B3%D0%BB%D1%8F%D0%B4_%D0%B7_%D0%B2%D1%83%D0%BB._%D0%97%D0%B0%D1%80%D1%96%D1%87%D0%BD%D0%BE%D1%97_2.jpg,https://upload.wikimedia.org/wikipedia/commons/7/7d/Mediterranian_Sea_Carthago_location.JPG","-17.833333333333 178.66666666667,null,null,null,null,null,null,null,null"
Employment,The primary sector share of total employment/year [Province] is 1.80%. The secondary sector share of total employment/year [Province] is 45.40%. The tertiary sector share of total employment/year [Province] is 52.80%. The primary sector share of total employment/year [Region] is 5.20%. The secondary sector share of total employment/year [Region] is 38.40%. The tertiary sector share of total employment/year [Region] is 56.40%.,"Primary sector of the economy, Secondary sector of the economy, Tertiary sector of the economy, Employment, Province, Region","http://www.wikidata.org/entity/Q55640, http://www.wikidata.org/entity/Q55639, http://www.wikidata.org/entity/Q55638, http://www.wikidata.org/entity/Q656365, http://www.wikidata.org/entity/Q34876, http://www.wikidata.org/entity/Q82794","includes farming, fishing & mining|industries that produce a finished, usable product or are involved in construction|service sector, as opposed to raw materials & manufacturing|gainful occupation|administrative division in several countries|2D or 3D defined space on something, mainly in terrestrial and astrophysics sciences","null,https://upload.wikimedia.org/wikipedia/commons/a/ac/The_woman_making_a_carpet_and_watching_TV_series.jpg,https://upload.wikimedia.org/wikipedia/commons/c/c6/US_Navy_030515-N-5862D-038_U.S._Navy_recruits_get_their_first_military_haircuts_at_the_Navy_Exchange_barbershop.jpg,https://upload.wikimedia.org/wikipedia/commons/5/59/Government_employment_as_%25_of_total_employment_in_EU.jpg,https://upload.wikimedia.org/wikipedia/commons/9/97/Map_of_country_subdivisions_%28provinces%29.svg,https://upload.wikimedia.org/wikipedia/commons/7/7d/Mediterranian_Sea_Carthago_location.JPG","null,null,null,null,null,null"
Interest on this VC,"On of prominent GI products, using the original recipe which is more than two centuries old, skilled artisans make Pirotski kackavalj (Hard cheese from Pirot), a very famous Serbian delicacy. Pirotski kackavalj made it to the list of intangible cultural heritage of Serbia. Pure milk from Stara planina and salt are the basic ingredients. It holds reputation for its soft but recognisable taste deriving from the high quality mild from the mountain pastures, and aslo traditional manual process. The decline of livestock production makes it particulalry fragile when it comes to the quantities on the market and also know how. In the Serbian part of Balkan mountains, Stara planina mt. there is a long tradition of livestock sheep production. Products such as Pirot kackavalj (yellow mixed or sheep cheese) and Pirot lamb are hightly valued and recognized, and protected as PDO. However the region is under many threats from depopulation and economic deprivation to pressures from tourism and environmental degradation. The Pirot cheese PDO doesnt live to its potential of bringing benefits to producers which are often invisible. The pastoral lifestyle is becoming rare.","Pirot, Serbia, Balkan Mountains, Intangible_cultural_heritage, Protected_designation_of_origin","http://www.wikidata.org/entity/Q309343, http://www.wikidata.org/entity/Q403, http://www.wikidata.org/entity/Q170427, http://www.wikidata.org/entity/Q84036549, http://www.wikidata.org/entity/Q13439060",city in Serbia|country in Southeast Europe|mountain range in the eastern part of the Balkan Peninsula|class of UNESCO designated cultural heritage|quality policy of the European Union for food,"https://upload.wikimedia.org/wikipedia/commons/a/ac/Pirot_-_Crveni_trg_nocu.jpg,null,https://upload.wikimedia.org/wikipedia/commons/7/7a/Balkangebirge_Balkan_topo_de.jpg,https://upload.wikimedia.org/wikipedia/commons/b/ba/Diablada_oruro_fraternidad.jpg,https://upload.wikimedia.org/wikipedia/commons/9/9e/2023_Oliwa_z_oliwek_Garda_DOP_%282%29.jpg","43.151944444444 22.585,43.95 20.933333333333,42.78421 24.97626,null,null"
Key local assets,"The natural properties of Stara planina natural park and its slopes and vicinity are initial condition for high quality product. Grazing areas, biodiversity and traditional know how are the strongest pillars for production of Pirot cheese. Social and cultural aspects are also strong, with particular equipemtn (weaving basket) used for cheese production. That made the whole cheese making skill part of the Serbian immaterial cultural heritage. ","Pirot, Serbia, Stara Planina, Biodiversity, Cultural heritage","http://www.wikidata.org/entity/Q309343, http://www.wikidata.org/entity/Q403, http://www.wikidata.org/entity/Q170427, http://www.wikidata.org/entity/Q47041, http://www.wikidata.org/entity/Q210272",city in Serbia|country in Southeast Europe|mountain range in the eastern part of the Balkan Peninsula|degree of variation of life forms|physical artifact or intangible attribute of a society inherited from past generations,"https://upload.wikimedia.org/wikipedia/commons/a/ac/Pirot_-_Crveni_trg_nocu.jpg,null,https://upload.wikimedia.org/wikipedia/commons/7/7a/Balkangebirge_Balkan_topo_de.jpg,https://upload.wikimedia.org/wikipedia/commons/c/cd/Animal_diversity_October_2007.jpg,https://upload.wikimedia.org/wikipedia/commons/4/43/Peru_Machu_Picchu_Sunrise.jpg","43.151944444444 22.585,43.95 20.933333333333,42.78421 24.97626,null,null"
Challenges,"Depopulation and change of lifestyle from pasture grazing system to stationary are the main reasons for decline in number of sheep and milk shortage. There are 13760 sheep now, and the are the aging and uninhabited villages cannot sustain the needed production. Apart from these, the management of natural resources bocomes an issue with increased vulnerability and threat of investments in small hydro power plants that deprive population from fresh water and destroy watershead and scenary. Overall the type of challenge faced by this VC is Current and Predicted. This VC is classified as Traditional and Innovative.","Depopulation, Pastoralism, Sheep, Village, Natural resource, Hydropower, Watershed, Venture capital, Tradition, Innovation","http://www.wikidata.org/entity/Q284137, http://www.wikidata.org/entity/Q9056738, http://www.wikidata.org/entity/Q7368, http://www.wikidata.org/entity/Q532, http://www.wikidata.org/entity/Q188460, http://www.wikidata.org/entity/Q170196, http://www.wikidata.org/entity/Q4018542, http://www.wikidata.org/entity/Q219409, http://www.wikidata.org/entity/Q82821, http://www.wikidata.org/entity/Q174165","depopulation in humans is any great reduction in a human population caused by events such as long-term demographic trends|branch of agriculture concerned with raising livestock|domesticated ruminant bred for meat, wool, and milk|small clustered human settlement smaller than a town|naturally occurring resource, including mineral resources (e.g. metal ores), mined fossil fuels (e.g. petroleum), water resources (e.g. lakes and groundwater), water energy resources, timber, arable land, game (e.g. deer), fish in water bodies, etc.|energy derived from falling or running water|Wikimedia disambiguation page|form of private equity financing that is provided by venture capital firms or funds to startups, early-stage, and emerging companies that have been deemed to have high growth potential or demonstrated high growth|custom passed down through generations|application of better solutions that meet new requirements, inarticulated needs, or existing market needs","null,https://upload.wikimedia.org/wikipedia/commons/0/0e/Himachal_Pradesh_sheep.jpg,https://upload.wikimedia.org/wikipedia/commons/2/2c/Flock_of_sheep.jpg,https://upload.wikimedia.org/wikipedia/commons/0/0f/Betley-_The_main_road%2C_looking_north%2C_the_postmans_bike_at_rest_-_geograph.org.uk_-_147874.jpg,https://upload.wikimedia.org/wikipedia/commons/b/b0/Tussen_Twist_en_Nieuw_Schoonebeek%2C_Alte_en_Neue_Energie_foto5_2016-09-25_14.29.jpg,https://upload.wikimedia.org/wikipedia/commons/7/72/The_Dam_%282890371280%29.jpg,null,null,https://upload.wikimedia.org/wikipedia/commons/4/47/Dreschen_mit_Flegel.jpg,null","null,null,null,null,null,null,null,null,null,null"
Innovation,"The type of innovation of this VC (Value Chain) is Endogenous and Exogenous. The VC is rather traditional with innovated marketing strategies and promoiton processes. The PDO registration is placed within Dairy secondary school in Pirot and that makes a good locus for spreading knowledge and know how. The innovation is related to New marketing strategies and New governance systems. The land use systems involved are Grassland and Natural land. The local assets include Natural, social and cultural.","Pirot, Value chain, Endogenous growth theory, Exogenous variable, Protected Designation of Origin, Marketing strategy, Governance, Grassland, Natural environment, Nature, Social capital, Culture","http://www.wikidata.org/entity/Q309343, http://www.wikidata.org/entity/Q646107, http://www.wikidata.org/entity/Q576355, http://www.wikidata.org/entity/Q61985482, http://www.wikidata.org/entity/Q13439060, http://www.wikidata.org/entity/Q1363963, http://www.wikidata.org/entity/Q1553864, http://www.wikidata.org/entity/Q1006733, http://www.wikidata.org/entity/Q43619, http://www.wikidata.org/entity/Q7860, http://www.wikidata.org/entity/Q214693, http://www.wikidata.org/entity/Q11042","city in Serbia|functions of a company affecting its costs and quality and give it a competitive advantage|theory that economic growth is mainly due to endogenous (not external) forces|variables in an economic model|quality policy of the European Union for food|business strategy for marketing and advertising|all of the processes of governing, whether undertaken by a government, market or network, whether over a family, tribe, formal or informal organization or territory and whether through the laws, norms, power or language of an organized society|area with vegetation dominated by grasses|all living and non-living things occurring naturally on Earth or some region thereof|natural, physical, or material world and its phenomena|sociology concept|shared aspects of a society's way of life","https://upload.wikimedia.org/wikipedia/commons/a/ac/Pirot_-_Crveni_trg_nocu.jpg,null,null,null,https://upload.wikimedia.org/wikipedia/commons/9/9e/2023_Oliwa_z_oliwek_Garda_DOP_%282%29.jpg,https://upload.wikimedia.org/wikipedia/commons/7/78/Extremates.png,null,https://upload.wikimedia.org/wikipedia/commons/9/9e/Chile_%283%29%2C_Patagonia%2C_Road_Y-50_towards_Rio_Verde.JPG,https://upload.wikimedia.org/wikipedia/commons/3/36/Hopetoun_falls.jpg,https://upload.wikimedia.org/wikipedia/commons/9/94/Desert_Electric.jpg,null,https://upload.wikimedia.org/wikipedia/commons/8/82/Nwodua_wulana_Alhassan.jpg","43.151944444444 22.585,null,null,null,null,null,null,null,null,null,null,null"
Concluding remarks,The same cheese production is present in Bulgaria.,"Bulgaria, Cheese","http://www.wikidata.org/entity/Q219, http://www.wikidata.org/entity/Q10943","country in southeast Europe|yellow or white, creamy or solid food made from the pressed curds of milk","https://upload.wikimedia.org/wikipedia/commons/4/46/Rila_Monastery%2C_August_2013.jpg,https://upload.wikimedia.org/wikipedia/commons/f/f2/Hartkaese_HardCheeses.jpg","42.75 25.5,null"
