title,description,objects,objectlinks,wikidata_descriptions,wikidata_images,wikidata_coords
Grain and cereal products,"The MOVING reference member state of this VC (Value Chain) is SWITZERLAND 1. The reference MOVING Card ID of this VC is VC 11 CH1. traditional land use, conventional agricutlure, regional labels in place.","Switzerland, Moving, Value chain, Land use, Agriculture, Geographical indication","http://www.wikidata.org/entity/Q39, http://www.wikidata.org/entity/Q1047402, http://www.wikidata.org/entity/Q646107, http://www.wikidata.org/entity/Q1165944, http://www.wikidata.org/entity/Q11451, http://www.wikidata.org/entity/Q325668",country in Central Europe|Wikimedia disambiguation page|functions of a company affecting its costs and quality and give it a competitive advantage|characterization of land based on what can be built on it and what the land can be used for|cultivation of plants and animals to provide useful products|name or sign used on certain products which corresponds to a specific geographical location or origin,"null,null,null,null,https://upload.wikimedia.org/wikipedia/commons/7/76/Unload_wheat_by_the_combine_Claas_Lexion_584.jpg,https://upload.wikimedia.org/wikipedia/commons/2/27/European_Union%27s_Geographical_Indications_logos_crop.png","46.798562 8.231973,null,null,null,null,null"
Mountain landscape and reference chains,The reference mountain chain of this VC is unspecified. The reference mountain landscape of this VC is unspecified.,"Mountain range, Mountain","http://www.wikidata.org/entity/Q46831, http://www.wikidata.org/entity/Q8502",geographic area containing several geologically related mountains|large natural elevation of the Earth's surface,"https://upload.wikimedia.org/wikipedia/commons/7/79/Himalayas.jpg,https://upload.wikimedia.org/wikipedia/commons/2/29/Himalayas%2C_Ama_Dablam%2C_Nepal.jpg","null,null"
Geography and population,The size of the area (km2) is unspecified. The minimum altimetry of the LAU (Local Administrative Unit) is unspecified. The maximum altimetry of the LAU is unspecified. The total population (in thousand) is unspecified. The population density (Inhabitants/km2) in the LAU is unspecified. The population change rate of the LAU in the last 10 years (%) is unspecified. The overall regional population density (Inhabitants/km2) is unspecified. The regional population change rate in the last 10 years (%) is unspecified.,"Lau Islands, Area, Altimetry, Local Administrative Unit, Population, Population density, Region","http://www.wikidata.org/entity/Q1062438, http://www.wikidata.org/entity/Q11500, http://www.wikidata.org/entity/Q216197, http://www.wikidata.org/entity/Q193083, http://www.wikidata.org/entity/Q175385, http://www.wikidata.org/entity/Q22856, http://www.wikidata.org/entity/Q82794","archipelago of Fiji|measure of the extent of a two-dimensional region on a curved surface or flat plane|instrument used to measure the altitude of an object above a fixed level|geocode standard for referencing the subdivisions of countries for statistical purposes|Wikimedia disambiguation page|measurement of population per unit area or unit volume|2D or 3D defined space on something, mainly in terrestrial and astrophysics sciences","https://upload.wikimedia.org/wikipedia/commons/6/6b/Lau_Islands_Yagasa_highres_STS098.jpg,null,https://upload.wikimedia.org/wikipedia/commons/c/c6/Aircraft_altimeter.JPG,null,null,https://upload.wikimedia.org/wikipedia/commons/4/4d/World_population_density_map.PNG,https://upload.wikimedia.org/wikipedia/commons/7/7d/Mediterranian_Sea_Carthago_location.JPG","-17.833333333333 178.66666666667,null,null,null,null,null,null"
Income and gross value added,The average per capita income (EUR/year) [Province] is unspecified. The total Gross Value Added (GVA) (EUR million/year) [Province] is unspecified. The primary sector share of total GVA/year [Province] is unspecified. The secondary sector share of total GVA/year [Province] is unspecified. The tertiary sector share of total GVA/year [Province] is unspecified. The per capita income (EUR/year) [Region] is unspecified. The total Gross Value Added (GVA) (EUR million/year) [Region] is unspecified. The primary sector share of total GVA/year [Region] is unspecified. The secondary sector share of total GVA/year [Region] is unspecified. The tertiary sector share of total GVA/year [Region] is unspecified.,"Per capita income, Gross value added, Primary sector, Secondary sector, Tertiary sector, Region, Province","http://www.wikidata.org/entity/Q45918, http://www.wikidata.org/entity/Q994873, http://www.wikidata.org/entity/Q55640, http://www.wikidata.org/entity/Q55639, http://www.wikidata.org/entity/Q55638, http://www.wikidata.org/entity/Q82794, http://www.wikidata.org/entity/Q34876","average income of an economy|economic indicator which adjusts gross domestic product (GDP) by the impact of subsidies and taxes (tariffs) on products|includes farming, fishing & mining|industries that produce a finished, usable product or are involved in construction|service sector, as opposed to raw materials & manufacturing|2D or 3D defined space on something, mainly in terrestrial and astrophysics sciences|administrative division in several countries","null,null,null,https://upload.wikimedia.org/wikipedia/commons/a/ac/The_woman_making_a_carpet_and_watching_TV_series.jpg,https://upload.wikimedia.org/wikipedia/commons/c/c6/US_Navy_030515-N-5862D-038_U.S._Navy_recruits_get_their_first_military_haircuts_at_the_Navy_Exchange_barbershop.jpg,https://upload.wikimedia.org/wikipedia/commons/7/7d/Mediterranian_Sea_Carthago_location.JPG,https://upload.wikimedia.org/wikipedia/commons/9/97/Map_of_country_subdivisions_%28provinces%29.svg","null,null,null,null,null,null,null"
Tourism,The total number of bed places (BPs) in tourist accommodations/year in the LAU (Local Administrative Unit) is unspecified. The regional (Region) share of total BPs/year is unspecified. The number of agricultural holdings in the LAU is unspecified. The nearest settlement with population over 100000 (km) is unspecified.,"Hotel room, Tourism, Local Administrative Unit, Region, Agricultural holding, Settlement, Population","http://www.wikidata.org/entity/Q27686, http://www.wikidata.org/entity/Q49389, http://www.wikidata.org/entity/Q193083, http://www.wikidata.org/entity/Q82794, http://www.wikidata.org/entity/Q131596, http://www.wikidata.org/entity/Q1247845, http://www.wikidata.org/entity/Q175385","business enterprise that provides indoor lodging in a single location paid on a short-term basis|travel for pleasure or business|geocode standard for referencing the subdivisions of countries for statistical purposes|2D or 3D defined space on something, mainly in terrestrial and astrophysics sciences|area of land for farming, or, for aquaculture, lake, river or sea, including various structures|Wikimedia disambiguation page|Wikimedia disambiguation page","https://upload.wikimedia.org/wikipedia/commons/9/98/PNY_Exterior_with_Rolls_Royce.jpg,https://upload.wikimedia.org/wikipedia/commons/b/b9/Tourism.png,null,https://upload.wikimedia.org/wikipedia/commons/7/7d/Mediterranian_Sea_Carthago_location.JPG,https://upload.wikimedia.org/wikipedia/commons/7/70/Borgboda2006_web.jpg,null,null","null,null,null,null,null,null,null"
Employment,The primary sector share of total employment/year [Province] is unspecified. The secondary sector share of total employment/year [Province] is unspecified. The tertiary sector share of total employment/year [Province] is unspecified. The primary sector share of total employment/year [Region] is unspecified. The secondary sector share of total employment/year [Region] is unspecified. The tertiary sector share of total employment/year [Region] is unspecified.,"Primary sector of the economy, Secondary sector of the economy, Tertiary sector of the economy, Employment, Province, Region","http://www.wikidata.org/entity/Q55640, http://www.wikidata.org/entity/Q55639, http://www.wikidata.org/entity/Q55638, http://www.wikidata.org/entity/Q656365, http://www.wikidata.org/entity/Q34876, http://www.wikidata.org/entity/Q82794","includes farming, fishing & mining|industries that produce a finished, usable product or are involved in construction|service sector, as opposed to raw materials & manufacturing|gainful occupation|administrative division in several countries|2D or 3D defined space on something, mainly in terrestrial and astrophysics sciences","null,https://upload.wikimedia.org/wikipedia/commons/a/ac/The_woman_making_a_carpet_and_watching_TV_series.jpg,https://upload.wikimedia.org/wikipedia/commons/c/c6/US_Navy_030515-N-5862D-038_U.S._Navy_recruits_get_their_first_military_haircuts_at_the_Navy_Exchange_barbershop.jpg,https://upload.wikimedia.org/wikipedia/commons/5/59/Government_employment_as_%25_of_total_employment_in_EU.jpg,https://upload.wikimedia.org/wikipedia/commons/9/97/Map_of_country_subdivisions_%28provinces%29.svg,https://upload.wikimedia.org/wikipedia/commons/7/7d/Mediterranian_Sea_Carthago_location.JPG","null,null,null,null,null,null"
Interest on this VC,"While the majority of Swiss cereal production is concentrated in the lowlands, cereals are also grown in the highest mountain regions. This includes all common European grains, including rice and maize. traditional land use.","Switzerland, Europe, Cereal, Rice, Maize, Land use","http://www.wikidata.org/entity/Q39, http://www.wikidata.org/entity/Q46, http://www.wikidata.org/entity/Q12117, http://www.wikidata.org/entity/Q5090, http://www.wikidata.org/entity/Q11575, http://www.wikidata.org/entity/Q1165944","country in Central Europe|terrestrial continent located in north-western Eurasia|grass cultivated for its edible grain|staple food grain of Oryza and Zizania species, for the plant see Q161426|species of grass cultivated as a food crop|characterization of land based on what can be built on it and what the land can be used for","null,https://upload.wikimedia.org/wikipedia/commons/1/1b/Europe_satellite_orthographic.jpg,https://upload.wikimedia.org/wikipedia/commons/1/17/Various_grains_edit2.jpg,https://upload.wikimedia.org/wikipedia/commons/7/7b/White%2C_Brown%2C_Red_%26_Wild_rice.jpg,https://upload.wikimedia.org/wikipedia/commons/7/73/Corntassel_7095.jpg,null","46.798562 8.231973,48.690959 9.14062,null,null,null,null"
Challenges,climate change. Overall the type of challenge faced by this VC is Predicted. This VC is classified as Traditional.,"Climate change, Venture capital, Prediction, Tradition","http://www.wikidata.org/entity/Q125928, http://www.wikidata.org/entity/Q219409, http://www.wikidata.org/entity/Q748250, http://www.wikidata.org/entity/Q82821","human-caused changes to climate on Earth|form of private equity financing that is provided by venture capital firms or funds to startups, early-stage, and emerging companies that have been deemed to have high growth potential or demonstrated high growth|statement about an uncertain event, which is often based upon knowledge, experience or speculation|custom passed down through generations","https://upload.wikimedia.org/wikipedia/commons/1/11/Carbon_Dioxide_800kyr.svg,null,null,https://upload.wikimedia.org/wikipedia/commons/4/47/Dreschen_mit_Flegel.jpg","null,null,null,null"
Innovation,The type of innovation of this VC (Value Chain) is unspecified. The innovation is related to the whole VC. The land use systems involved are Cropland. The local assets include Natural.,"Value chain, Cropland, Nature","http://www.wikidata.org/entity/Q646107, http://www.wikidata.org/entity/Q3395383, http://www.wikidata.org/entity/Q7860","functions of a company affecting its costs and quality and give it a competitive advantage|land used for agricultural purposes|natural, physical, or material world and its phenomena","null,https://upload.wikimedia.org/wikipedia/commons/3/39/Hoeve_Groot_Amelgem%2C_Wolvertem_05.jpg,https://upload.wikimedia.org/wikipedia/commons/9/94/Desert_Electric.jpg","null,null,null"
