title,description,objects,objectlinks,wikidata_descriptions,wikidata_images,wikidata_coords
'GranAlpin' cereal products,"The MOVING reference member state of this VC (Value Chain) is SWITZERLAND 1. The reference MOVING Card ID of this VC is VC 12 CH1. Gran Alpin is a label for cereals produced above a certain altitude and in organic production systems. It also supports the production of more varieties of cereal. Some cereal specialties, such as buckwheat, used to be grown much more in the mountains, but were then replaced by imported products. In recent years, some producers have started to grow buckwheat again in Graubünden.This is because some traditional mountain dishes are prepared with this cereal, e.g. pizzocheri, a traditional pasta-like dish in Graubünden.","Switzerland, Value chain, Cereal, Organic farming, Buckwheat, Graubünden, Pizzoccheri, Pasta","http://www.wikidata.org/entity/Q39, http://www.wikidata.org/entity/Q646107, http://www.wikidata.org/entity/Q12117, http://www.wikidata.org/entity/Q165647, http://www.wikidata.org/entity/Q132734, http://www.wikidata.org/entity/Q11925, http://www.wikidata.org/entity/Q20042, http://www.wikidata.org/entity/Q178","country in Central Europe|functions of a company affecting its costs and quality and give it a competitive advantage|grass cultivated for its edible grain|farming method that avoids synthetic inputs, at the cost of lower yields and higher labor demands compared to conventional agriculture|species of flowering plant in the family Polygonaceae|canton of Switzerland|type of short tagliatelle, a flat ribbon pasta|Italian food made from flour, eggs and water and shaped in different forms, usually cooked and served with a sauce","null,null,https://upload.wikimedia.org/wikipedia/commons/1/17/Various_grains_edit2.jpg,https://upload.wikimedia.org/wikipedia/commons/3/38/Organic-vegetable-cultivation.jpeg,https://upload.wikimedia.org/wikipedia/commons/f/f7/Fagopyrum_esculentum_1DS-II_3-0312.jpg,https://upload.wikimedia.org/wikipedia/commons/b/b8/Chur.jpg,https://upload.wikimedia.org/wikipedia/commons/9/9f/Pizzoccheri.jpg,https://upload.wikimedia.org/wikipedia/commons/3/33/Pasta_IMG_3985.JPG","46.798562 8.231973,null,null,null,null,46.75 9.5,null,null"
Mountain landscape and reference chains,The reference mountain chain of this VC is unspecified. The reference mountain landscape of this VC is unspecified.,"Mountain range, Mountain","http://www.wikidata.org/entity/Q46831, http://www.wikidata.org/entity/Q8502",geographic area containing several geologically related mountains|large natural elevation of the Earth's surface,"https://upload.wikimedia.org/wikipedia/commons/7/79/Himalayas.jpg,https://upload.wikimedia.org/wikipedia/commons/2/29/Himalayas%2C_Ama_Dablam%2C_Nepal.jpg","null,null"
Geography and population,The size of the area (km2) is unspecified. The minimum altimetry of the LAU (Local Administrative Unit) is unspecified. The maximum altimetry of the LAU is unspecified. The total population (in thousand) is unspecified. The population density (Inhabitants/km2) in the LAU is unspecified. The population change rate of the LAU in the last 10 years (%) is unspecified. The overall regional population density (Inhabitants/km2) is unspecified. The regional population change rate in the last 10 years (%) is unspecified.,"Lau Islands, Area, Altimetry, Local Administrative Unit, Population, Population density, Region","http://www.wikidata.org/entity/Q1062438, http://www.wikidata.org/entity/Q11500, http://www.wikidata.org/entity/Q216197, http://www.wikidata.org/entity/Q193083, http://www.wikidata.org/entity/Q175385, http://www.wikidata.org/entity/Q22856, http://www.wikidata.org/entity/Q82794","archipelago of Fiji|measure of the extent of a two-dimensional region on a curved surface or flat plane|instrument used to measure the altitude of an object above a fixed level|geocode standard for referencing the subdivisions of countries for statistical purposes|Wikimedia disambiguation page|measurement of population per unit area or unit volume|2D or 3D defined space on something, mainly in terrestrial and astrophysics sciences","https://upload.wikimedia.org/wikipedia/commons/6/6b/Lau_Islands_Yagasa_highres_STS098.jpg,null,https://upload.wikimedia.org/wikipedia/commons/c/c6/Aircraft_altimeter.JPG,null,null,https://upload.wikimedia.org/wikipedia/commons/4/4d/World_population_density_map.PNG,https://upload.wikimedia.org/wikipedia/commons/7/7d/Mediterranian_Sea_Carthago_location.JPG","-17.833333333333 178.66666666667,null,null,null,null,null,null"
Income and gross value added,The average per capita income (EUR/year) [Province] is unspecified. The total Gross Value Added (GVA) (EUR million/year) [Province] is unspecified. The primary sector share of total GVA/year [Province] is unspecified. The secondary sector share of total GVA/year [Province] is unspecified. The tertiary sector share of total GVA/year [Province] is unspecified. The per capita income (EUR/year) [Region] is unspecified. The total Gross Value Added (GVA) (EUR million/year) [Region] is unspecified. The primary sector share of total GVA/year [Region] is unspecified. The secondary sector share of total GVA/year [Region] is unspecified. The tertiary sector share of total GVA/year [Region] is unspecified.,"Per capita income, Gross value added, Primary sector, Secondary sector, Tertiary sector, Region, Province","http://www.wikidata.org/entity/Q45918, http://www.wikidata.org/entity/Q994873, http://www.wikidata.org/entity/Q55640, http://www.wikidata.org/entity/Q55639, http://www.wikidata.org/entity/Q55638, http://www.wikidata.org/entity/Q82794, http://www.wikidata.org/entity/Q34876","average income of an economy|economic indicator which adjusts gross domestic product (GDP) by the impact of subsidies and taxes (tariffs) on products|includes farming, fishing & mining|industries that produce a finished, usable product or are involved in construction|service sector, as opposed to raw materials & manufacturing|2D or 3D defined space on something, mainly in terrestrial and astrophysics sciences|administrative division in several countries","null,null,null,https://upload.wikimedia.org/wikipedia/commons/a/ac/The_woman_making_a_carpet_and_watching_TV_series.jpg,https://upload.wikimedia.org/wikipedia/commons/c/c6/US_Navy_030515-N-5862D-038_U.S._Navy_recruits_get_their_first_military_haircuts_at_the_Navy_Exchange_barbershop.jpg,https://upload.wikimedia.org/wikipedia/commons/7/7d/Mediterranian_Sea_Carthago_location.JPG,https://upload.wikimedia.org/wikipedia/commons/9/97/Map_of_country_subdivisions_%28provinces%29.svg","null,null,null,null,null,null,null"
Tourism,The total number of bed places (BPs) in tourist accommodations/year in the LAU (Local Administrative Unit) is unspecified. The regional (Region) share of total BPs/year is unspecified. The number of agricultural holdings in the LAU is unspecified. The nearest settlement with population over 100000 (km) is unspecified.,"Hotel room, Tourism, Local Administrative Unit, Region, Agricultural holding, Settlement, Population","http://www.wikidata.org/entity/Q27686, http://www.wikidata.org/entity/Q49389, http://www.wikidata.org/entity/Q193083, http://www.wikidata.org/entity/Q82794, http://www.wikidata.org/entity/Q131596, http://www.wikidata.org/entity/Q1247845, http://www.wikidata.org/entity/Q175385","business enterprise that provides indoor lodging in a single location paid on a short-term basis|travel for pleasure or business|geocode standard for referencing the subdivisions of countries for statistical purposes|2D or 3D defined space on something, mainly in terrestrial and astrophysics sciences|area of land for farming, or, for aquaculture, lake, river or sea, including various structures|Wikimedia disambiguation page|Wikimedia disambiguation page","https://upload.wikimedia.org/wikipedia/commons/9/98/PNY_Exterior_with_Rolls_Royce.jpg,https://upload.wikimedia.org/wikipedia/commons/b/b9/Tourism.png,null,https://upload.wikimedia.org/wikipedia/commons/7/7d/Mediterranian_Sea_Carthago_location.JPG,https://upload.wikimedia.org/wikipedia/commons/7/70/Borgboda2006_web.jpg,null,null","null,null,null,null,null,null,null"
Employment,The primary sector share of total employment/year [Province] is unspecified. The secondary sector share of total employment/year [Province] is unspecified. The tertiary sector share of total employment/year [Province] is unspecified. The primary sector share of total employment/year [Region] is unspecified. The secondary sector share of total employment/year [Region] is unspecified. The tertiary sector share of total employment/year [Region] is unspecified.,"Primary sector of the economy, Secondary sector of the economy, Tertiary sector of the economy, Employment, Province, Region","http://www.wikidata.org/entity/Q55640, http://www.wikidata.org/entity/Q55639, http://www.wikidata.org/entity/Q55638, http://www.wikidata.org/entity/Q656365, http://www.wikidata.org/entity/Q34876, http://www.wikidata.org/entity/Q82794","includes farming, fishing & mining|industries that produce a finished, usable product or are involved in construction|service sector, as opposed to raw materials & manufacturing|gainful occupation|administrative division in several countries|2D or 3D defined space on something, mainly in terrestrial and astrophysics sciences","null,https://upload.wikimedia.org/wikipedia/commons/a/ac/The_woman_making_a_carpet_and_watching_TV_series.jpg,https://upload.wikimedia.org/wikipedia/commons/c/c6/US_Navy_030515-N-5862D-038_U.S._Navy_recruits_get_their_first_military_haircuts_at_the_Navy_Exchange_barbershop.jpg,https://upload.wikimedia.org/wikipedia/commons/5/59/Government_employment_as_%25_of_total_employment_in_EU.jpg,https://upload.wikimedia.org/wikipedia/commons/9/97/Map_of_country_subdivisions_%28provinces%29.svg,https://upload.wikimedia.org/wikipedia/commons/7/7d/Mediterranian_Sea_Carthago_location.JPG","null,null,null,null,null,null"
Interest on this VC,"super successfull label that re-values what is already there, GranAlpin presents grains grown in an organic way above a certain altitude in a certain region, this is basically how it has always been done. the label enables the products to be sold at a higher price, another part of the label is to keep the VC as local as possible, e.g. by reviving old mills.","Organic farming, Altitude, Region, Mill, Venture capital","http://www.wikidata.org/entity/Q165647, http://www.wikidata.org/entity/Q190200, http://www.wikidata.org/entity/Q82794, http://www.wikidata.org/entity/Q4761205, http://www.wikidata.org/entity/Q219409","farming method that avoids synthetic inputs, at the cost of lower yields and higher labor demands compared to conventional agriculture|height in relation to a certain reference point|2D or 3D defined space on something, mainly in terrestrial and astrophysics sciences|Wikimedia disambiguation page|form of private equity financing that is provided by venture capital firms or funds to startups, early-stage, and emerging companies that have been deemed to have high growth potential or demonstrated high growth","https://upload.wikimedia.org/wikipedia/commons/3/38/Organic-vegetable-cultivation.jpeg,https://upload.wikimedia.org/wikipedia/commons/9/9f/Altitude_marker%2C_Lismore.jpg,https://upload.wikimedia.org/wikipedia/commons/7/7d/Mediterranian_Sea_Carthago_location.JPG,null,null","null,null,null,null,null"
Challenges,"label is so successfulll, not enough farmers use it, problems with water scarcity and dry weather as well as with pests. Overall the type of challenge faced by this VC is Current and Predicted. This VC is classified as Innovative.","Farmer, Water scarcity, Drought, Pest, Venture capital","http://www.wikidata.org/entity/Q131512, http://www.wikidata.org/entity/Q5376358, http://www.wikidata.org/entity/Q43059, http://www.wikidata.org/entity/Q235306, http://www.wikidata.org/entity/Q219409","person engaged in agriculture, raising living organisms for food or raw materials|when water demand exceeds available resources|extended period when a region notes a deficiency in its water supply|Wikimedia disambiguation page|form of private equity financing that is provided by venture capital firms or funds to startups, early-stage, and emerging companies that have been deemed to have high growth potential or demonstrated high growth","https://upload.wikimedia.org/wikipedia/commons/a/a2/04-09-12-Schaupfl%C3%BCgen-Fahrenwalde-RalfR-IMG_1232.jpg,https://upload.wikimedia.org/wikipedia/commons/e/e1/Drought.jpg,https://upload.wikimedia.org/wikipedia/commons/e/e1/Drought.jpg,null,null","null,null,null,null,null"
Innovation,"The type of innovation of this VC (Value Chain) is Endogenous. the only innovation is the label and thus the way of marketing and highliting the high quality of the product. The innovation is related to New processes and New marketing strategies. The land use systems involved are Cropland. The local assets include Natural, social and cultural.","Venture capital, Endogenous growth theory, Marketing, Cropland, Nature, Social capital, Culture","http://www.wikidata.org/entity/Q219409, http://www.wikidata.org/entity/Q576355, http://www.wikidata.org/entity/Q39809, http://www.wikidata.org/entity/Q3395383, http://www.wikidata.org/entity/Q7860, http://www.wikidata.org/entity/Q214693, http://www.wikidata.org/entity/Q11042","form of private equity financing that is provided by venture capital firms or funds to startups, early-stage, and emerging companies that have been deemed to have high growth potential or demonstrated high growth|theory that economic growth is mainly due to endogenous (not external) forces|study and process of promoting, distributing, and selling products or services to customers|land used for agricultural purposes|natural, physical, or material world and its phenomena|sociology concept|shared aspects of a society's way of life","null,null,null,https://upload.wikimedia.org/wikipedia/commons/3/39/Hoeve_Groot_Amelgem%2C_Wolvertem_05.jpg,https://upload.wikimedia.org/wikipedia/commons/9/94/Desert_Electric.jpg,null,https://upload.wikimedia.org/wikipedia/commons/8/82/Nwodua_wulana_Alhassan.jpg","null,null,null,null,null,null,null"
