title,description,objects,objectlinks,wikidata_descriptions,wikidata_images,wikidata_coords
CULINARY GUIDEBOOK TO THE EASTERN RHODOPES,The MOVING reference member state of this VC (Value Chain) is BULGARIA. The reference MOVING Card ID of this VC is VC 20 BG.,"Bulgaria, Moving, Value chain","http://www.wikidata.org/entity/Q219, http://www.wikidata.org/entity/Q1047402, http://www.wikidata.org/entity/Q646107",country in southeast Europe|Wikimedia disambiguation page|functions of a company affecting its costs and quality and give it a competitive advantage,"https://upload.wikimedia.org/wikipedia/commons/4/46/Rila_Monastery%2C_August_2013.jpg,null,null","42.75 25.5,null,null"
Mountain landscape and reference chains,The reference mountain chain of this VC is Eastern Rhodope Mountains. The reference mountain landscape of this VC is Kardzhali Municipality in Kardzhali Province (BG425).,"Rhodope Mountains, Kardzhali Municipality, Kardzhali Province","http://www.wikidata.org/entity/Q6489, http://www.wikidata.org/entity/Q2452987, http://www.wikidata.org/entity/Q1104675","mountain range in southeastern Balkans|municipality in Kardzhali oblast, Bulgaria|oblast of Bulgaria","https://upload.wikimedia.org/wikipedia/commons/4/48/Rhodopen_Balkan_topo_de.jpg,null,https://upload.wikimedia.org/wikipedia/commons/3/31/Village-Karamfil-Bulgaria.JPG","41.601111111111 24.574166666667,41.65 25.367,41.65 25.366666666667"
Geography and population,The size of the area (km2) is 574.7. The minimum altimetry of the LAU (Local Administrative Unit) is unspecified. The maximum altimetry of the LAU is unspecified. The total population (in thousand) is 68.727. The population density (Inhabitants/km2) in the LAU is 119.59. The population change rate of the LAU in the last 10 years (%) is unspecified. The overall regional population density (Inhabitants/km2) is 63.70. The regional population change rate in the last 10 years (%) has been -0.06%.,"Lau Islands, Square kilometre, Altitude, Local Administrative Unit, Population, Population density, Region","http://www.wikidata.org/entity/Q1062438, http://www.wikidata.org/entity/Q712226, http://www.wikidata.org/entity/Q190200, http://www.wikidata.org/entity/Q193083, http://www.wikidata.org/entity/Q175385, http://www.wikidata.org/entity/Q22856, http://www.wikidata.org/entity/Q82794","archipelago of Fiji|decimal multiple of the SI unit of surface area|height in relation to a certain reference point|geocode standard for referencing the subdivisions of countries for statistical purposes|Wikimedia disambiguation page|measurement of population per unit area or unit volume|2D or 3D defined space on something, mainly in terrestrial and astrophysics sciences","https://upload.wikimedia.org/wikipedia/commons/6/6b/Lau_Islands_Yagasa_highres_STS098.jpg,https://upload.wikimedia.org/wikipedia/commons/1/19/1_km2.svg,https://upload.wikimedia.org/wikipedia/commons/9/9f/Altitude_marker%2C_Lismore.jpg,null,null,https://upload.wikimedia.org/wikipedia/commons/4/4d/World_population_density_map.PNG,https://upload.wikimedia.org/wikipedia/commons/7/7d/Mediterranian_Sea_Carthago_location.JPG","-17.833333333333 178.66666666667,null,null,null,null,null,null"
Income and gross value added,The average per capita income (EUR/year) [Province] is 4300. The total Gross Value Added (GVA) (EUR million/year) [Province] is 570.9. The primary sector share of total GVA/year [Province] is 12.90%. The secondary sector share of total GVA/year [Province] is 33.50%. The tertiary sector share of total GVA/year [Province] is 53.50%. The per capita income (EUR/year) [Region] is 5600. The total Gross Value Added (GVA) (EUR million/year) [Region] is 6888. The primary sector share of total GVA/year [Region] is 5.90%. The secondary sector share of total GVA/year [Region] is 35.20%. The tertiary sector share of total GVA/year [Region] is 59.00%.,"Per capita income, Gross value added, Primary sector, Secondary sector, Tertiary sector, Region, Province","http://www.wikidata.org/entity/Q45918, http://www.wikidata.org/entity/Q994873, http://www.wikidata.org/entity/Q55640, http://www.wikidata.org/entity/Q55639, http://www.wikidata.org/entity/Q55638, http://www.wikidata.org/entity/Q82794, http://www.wikidata.org/entity/Q34876","average income of an economy|economic indicator which adjusts gross domestic product (GDP) by the impact of subsidies and taxes (tariffs) on products|includes farming, fishing & mining|industries that produce a finished, usable product or are involved in construction|service sector, as opposed to raw materials & manufacturing|2D or 3D defined space on something, mainly in terrestrial and astrophysics sciences|administrative division in several countries","null,null,null,https://upload.wikimedia.org/wikipedia/commons/a/ac/The_woman_making_a_carpet_and_watching_TV_series.jpg,https://upload.wikimedia.org/wikipedia/commons/c/c6/US_Navy_030515-N-5862D-038_U.S._Navy_recruits_get_their_first_military_haircuts_at_the_Navy_Exchange_barbershop.jpg,https://upload.wikimedia.org/wikipedia/commons/7/7d/Mediterranian_Sea_Carthago_location.JPG,https://upload.wikimedia.org/wikipedia/commons/9/97/Map_of_country_subdivisions_%28provinces%29.svg","null,null,null,null,null,null,null"
Tourism,The total number of bed places (BPs) in tourist accommodations/year in the LAU (Local Administrative Unit) is 754. The regional (Region) share of total BPs/year is 2.80%. The number of agricultural holdings in the LAU is 21240. The nearest settlement with population over 100000 (km) is unspecified. In this region protected areas are present.,"Lau Islands, Hotel room, Tourism, Local Administrative Unit, Region, Agricultural holding, Settlement, Protected area","http://www.wikidata.org/entity/Q1062438, http://www.wikidata.org/entity/Q27686, http://www.wikidata.org/entity/Q49389, http://www.wikidata.org/entity/Q193083, http://www.wikidata.org/entity/Q82794, http://www.wikidata.org/entity/Q131596, http://www.wikidata.org/entity/Q1247845, http://www.wikidata.org/entity/Q473972","archipelago of Fiji|business enterprise that provides indoor lodging in a single location paid on a short-term basis|travel for pleasure or business|geocode standard for referencing the subdivisions of countries for statistical purposes|2D or 3D defined space on something, mainly in terrestrial and astrophysics sciences|area of land for farming, or, for aquaculture, lake, river or sea, including various structures|Wikimedia disambiguation page|areas protected for having ecological or cultural importance","https://upload.wikimedia.org/wikipedia/commons/6/6b/Lau_Islands_Yagasa_highres_STS098.jpg,https://upload.wikimedia.org/wikipedia/commons/9/98/PNY_Exterior_with_Rolls_Royce.jpg,https://upload.wikimedia.org/wikipedia/commons/b/b9/Tourism.png,null,https://upload.wikimedia.org/wikipedia/commons/7/7d/Mediterranian_Sea_Carthago_location.JPG,https://upload.wikimedia.org/wikipedia/commons/7/70/Borgboda2006_web.jpg,null,https://upload.wikimedia.org/wikipedia/commons/d/df/%D0%A1%D1%82%D1%96%D0%BB%D1%8C%D1%81%D1%8C%D0%BA%D0%B5_%D0%93%D0%BE%D1%80%D0%BE%D0%B4%D0%B8%D1%89%D0%B5%2C_%D0%B2%D0%B8%D0%B3%D0%BB%D1%8F%D0%B4_%D0%B7_%D0%B2%D1%83%D0%BB._%D0%97%D0%B0%D1%80%D1%96%D1%87%D0%BD%D0%BE%D1%97_2.jpg","-17.833333333333 178.66666666667,null,null,null,null,null,null,null"
Employment,The primary sector share of total employment/year [Province] is 41.90%. The secondary sector share of total employment/year [Province] is 24.80%. The tertiary sector share of total employment/year [Province] is 33.20%. The primary sector share of total employment/year [Region] is 24.20%. The secondary sector share of total employment/year [Region] is 30.70%. The tertiary sector share of total employment/year [Region] is 45.10%.,"Primary sector of the economy, Secondary sector of the economy, Tertiary sector of the economy, Employment, Province, Region","http://www.wikidata.org/entity/Q55640, http://www.wikidata.org/entity/Q55639, http://www.wikidata.org/entity/Q55638, http://www.wikidata.org/entity/Q656365, http://www.wikidata.org/entity/Q34876, http://www.wikidata.org/entity/Q82794","includes farming, fishing & mining|industries that produce a finished, usable product or are involved in construction|service sector, as opposed to raw materials & manufacturing|gainful occupation|administrative division in several countries|2D or 3D defined space on something, mainly in terrestrial and astrophysics sciences","null,https://upload.wikimedia.org/wikipedia/commons/a/ac/The_woman_making_a_carpet_and_watching_TV_series.jpg,https://upload.wikimedia.org/wikipedia/commons/c/c6/US_Navy_030515-N-5862D-038_U.S._Navy_recruits_get_their_first_military_haircuts_at_the_Navy_Exchange_barbershop.jpg,https://upload.wikimedia.org/wikipedia/commons/5/59/Government_employment_as_%25_of_total_employment_in_EU.jpg,https://upload.wikimedia.org/wikipedia/commons/9/97/Map_of_country_subdivisions_%28provinces%29.svg,https://upload.wikimedia.org/wikipedia/commons/7/7d/Mediterranian_Sea_Carthago_location.JPG","null,null,null,null,null,null"
Interest on this VC,"A Culinary Guidebook with 28 recipes and typical and popular local dishes from the region of the Eastern Rhodopes. The book provides also information about the food products and organic farms where the ingredients can be bought. A list of places (BandB's, hotels, restaurants) where the dishes are offered to the guests is also included in the book.","Rhodope Mountains, Culinary arts, Recipe, Dish, Organic farming, Bed and breakfast, Hotel, Restaurant","http://www.wikidata.org/entity/Q6489, http://www.wikidata.org/entity/Q2111686, http://www.wikidata.org/entity/Q219239, http://www.wikidata.org/entity/Q621325, http://www.wikidata.org/entity/Q165647, http://www.wikidata.org/entity/Q367914, http://www.wikidata.org/entity/Q27686, http://www.wikidata.org/entity/Q11707","mountain range in southeastern Balkans|art of the preparation, cooking and presentation of food, usually in the form of meals|a set of instructions for preparing a processed food item|Wikimedia disambiguation page|farming method that avoids synthetic inputs, at the cost of lower yields and higher labor demands compared to conventional agriculture|small lodging establishment|business enterprise that provides indoor lodging in a single location paid on a short-term basis|single establishment which prepares and serves food, located in building","https://upload.wikimedia.org/wikipedia/commons/4/48/Rhodopen_Balkan_topo_de.jpg,https://upload.wikimedia.org/wikipedia/commons/2/29/20150319-OC-LSC-0194_%2816682627630%29.jpg,https://upload.wikimedia.org/wikipedia/commons/d/d8/Betty_Crocker%27s_Cook_Book_for_Boys_and_Girls.djvu,null,https://upload.wikimedia.org/wikipedia/commons/3/38/Organic-vegetable-cultivation.jpeg,https://upload.wikimedia.org/wikipedia/commons/8/85/Hasselt%2C_bed%26breakfast_de_Oude_Jan_met_twee_monumentale_kalkovens_RM489135_IMG_2081_2018-04-07_14.43.jpg,https://upload.wikimedia.org/wikipedia/commons/9/98/PNY_Exterior_with_Rolls_Royce.jpg,https://upload.wikimedia.org/wikipedia/commons/9/98/Gaggenau_2016_-Restaurant-_by-RaBoe_118.jpg","41.601111111111 24.574166666667,null,null,null,null,null,null,null"
Challenges,N/A. Overall the type of challenge faced by this VC is Current. This VC is classified as Innovative.,"Venture capital, Innovation, Present","http://www.wikidata.org/entity/Q219409, http://www.wikidata.org/entity/Q174165, http://www.wikidata.org/entity/Q193168","form of private equity financing that is provided by venture capital firms or funds to startups, early-stage, and emerging companies that have been deemed to have high growth potential or demonstrated high growth|application of better solutions that meet new requirements, inarticulated needs, or existing market needs|period of time occurring now","null,null,null","null,null,null"
Innovation,The type of innovation of this VC (Value Chain) is Exogenous. The innovation is related to New marketing strategies. The land use systems involved are N/A. The local assets include Cultural.,"Value chain, Exogenous variable, Marketing strategy, Land use, Culture","http://www.wikidata.org/entity/Q646107, http://www.wikidata.org/entity/Q61985482, http://www.wikidata.org/entity/Q1363963, http://www.wikidata.org/entity/Q1165944, http://www.wikidata.org/entity/Q11042",functions of a company affecting its costs and quality and give it a competitive advantage|variables in an economic model|business strategy for marketing and advertising|characterization of land based on what can be built on it and what the land can be used for|shared aspects of a society's way of life,"null,null,https://upload.wikimedia.org/wikipedia/commons/7/78/Extremates.png,null,https://upload.wikimedia.org/wikipedia/commons/8/82/Nwodua_wulana_Alhassan.jpg","null,null,null,null,null"
