title,description,objects,objectlinks,wikidata_descriptions,wikidata_images,wikidata_coords
Guadarrama goats,"The MOVING reference member state of this VC (Value Chain) is SPAIN UCO. The reference MOVING Card ID of this VC is VC 22 ES. The goats produce various values. On one side, the milky goats are sold for cooking traditional dishes. In addition, it serves as touristic asset as the activity is also promoted by the administration of the Guadarrama National Park. There are some conflicts with the other livestock producers of the area in the use of common lands. Also the neighbours of the municipality play a role because they live with the herd, so they must agree with its presence as a public asset. Regarding the connection with the social-ecological-system, the herd generates multiple benefits and ecosystem services (e.g., fire prevention, cleaning the public land of bushes, composting, cultural asset, and a potential profitable activity).","Guadarrama National Park, Spain, Livestock, Ecosystem services","http://www.wikidata.org/entity/Q1324805, http://www.wikidata.org/entity/Q29, http://www.wikidata.org/entity/Q103459, http://www.wikidata.org/entity/Q295865","national park in Spain|country in southwestern Europe with territories in Africa|domesticated animals raised in an agricultural setting to produce commodities such as food, fiber and labor|benefits created by nature, forests and environmental systems","https://upload.wikimedia.org/wikipedia/commons/3/3f/Circo_y_cima_de_Pe%C3%B1alara1.JPG,https://upload.wikimedia.org/wikipedia/commons/d/d3/Spain_-_Location_Map_%282013%29_-_ESP_-_UNOCHA.svg,https://upload.wikimedia.org/wikipedia/commons/9/9a/Edward_Hicks_001.jpg,https://upload.wikimedia.org/wikipedia/commons/e/e3/Bee_pollinating_Aquilegia_vulgaris.JPG","40.78333333 -3.98333333,40.2 -3.5,null,null"
Mountain landscape and reference chains,"The reference mountain chain of this VC is Sierra del Guadarrama. The reference mountain landscape of this VC is El Boalo. The MRL belongs to the TERRAE Network. This is a national network of municipalities that use the principles of the Agroecology as values and basis for their development. Therefore, they aim for a sustainable future for their municipalities, with special attention to food chains and social cohesion.","El Boalo, Agroecology, Sierra de Guadarrama, Municipality, Food chain, Social cohesion","http://www.wikidata.org/entity/Q1772163, http://www.wikidata.org/entity/Q396338, http://www.wikidata.org/entity/Q53711, http://www.wikidata.org/entity/Q15284, http://www.wikidata.org/entity/Q159462, http://www.wikidata.org/entity/Q553270","municipality in the Community of Madrid, Spain|study of ecological processes in agriculture|Central System mountain range, in the center of the Iberian Peninsula|administrative division having corporate status and usually powers of self-government or jurisdiction|aspects of the ecosystem|bonding between members of a group","https://upload.wikimedia.org/wikipedia/commons/a/ac/Ayuntamiento_de_El_Boalo.jpg,https://upload.wikimedia.org/wikipedia/commons/c/c3/Agribusiness_vs_agroecology.jpg,https://upload.wikimedia.org/wikipedia/commons/b/be/Viajando_%2891445844%29_%28color%2C_contrast%29.jpg,null,https://upload.wikimedia.org/wikipedia/commons/a/a7/FoodWeb.svg,https://upload.wikimedia.org/wikipedia/commons/c/c8/Soziologie_01.jpg","40.71888888888889 -3.9205555555555556,null,40.850139 -3.956231,null,null,null"
Geography and population,The size of the area (km2) is 40.13. The minimum altimetry of the LAU (Local Administrative Unit) is 930. The maximum altimetry of the LAU is 2227. The total population (in thousand) is unspecified. The population density (Inhabitants/km2) in the LAU is 190.95. The population change rate of the LAU in the last 10 years (%) has been 15.44%. The overall regional population density (Inhabitants/km2) is unspecified. The regional population change rate in the last 10 years (%) is unspecified.,"Lau Islands, Square kilometre, Altitude, Local Administrative Unit, Population, Population density, Region","http://www.wikidata.org/entity/Q1062438, http://www.wikidata.org/entity/Q712226, http://www.wikidata.org/entity/Q190200, http://www.wikidata.org/entity/Q193083, http://www.wikidata.org/entity/Q175385, http://www.wikidata.org/entity/Q22856, http://www.wikidata.org/entity/Q82794","archipelago of Fiji|decimal multiple of the SI unit of surface area|height in relation to a certain reference point|geocode standard for referencing the subdivisions of countries for statistical purposes|Wikimedia disambiguation page|measurement of population per unit area or unit volume|2D or 3D defined space on something, mainly in terrestrial and astrophysics sciences","https://upload.wikimedia.org/wikipedia/commons/6/6b/Lau_Islands_Yagasa_highres_STS098.jpg,https://upload.wikimedia.org/wikipedia/commons/1/19/1_km2.svg,https://upload.wikimedia.org/wikipedia/commons/9/9f/Altitude_marker%2C_Lismore.jpg,null,null,https://upload.wikimedia.org/wikipedia/commons/4/4d/World_population_density_map.PNG,https://upload.wikimedia.org/wikipedia/commons/7/7d/Mediterranian_Sea_Carthago_location.JPG","-17.833333333333 178.66666666667,null,null,null,null,null,null"
Income and gross value added,The average per capita income (EUR/year) [Province] is 18555.67. The total Gross Value Added (GVA) (EUR million/year) [Province] is 111602. The primary sector share of total GVA/year [Province] is 1.20%. The secondary sector share of total GVA/year [Province] is 19.96%. The tertiary sector share of total GVA/year [Province] is 78.83%. The per capita income (EUR/year) [Region] is unspecified. The total Gross Value Added (GVA) (EUR million/year) [Region] is unspecified. The primary sector share of total GVA/year [Region] is unspecified. The secondary sector share of total GVA/year [Region] is unspecified. The tertiary sector share of total GVA/year [Region] is unspecified.,"Per capita income, Gross value added, Primary sector, Secondary sector, Tertiary sector, Province, Region, Euro","http://www.wikidata.org/entity/Q45918, http://www.wikidata.org/entity/Q994873, http://www.wikidata.org/entity/Q55640, http://www.wikidata.org/entity/Q55639, http://www.wikidata.org/entity/Q55638, http://www.wikidata.org/entity/Q34876, http://www.wikidata.org/entity/Q82794, http://www.wikidata.org/entity/Q4916","average income of an economy|economic indicator which adjusts gross domestic product (GDP) by the impact of subsidies and taxes (tariffs) on products|includes farming, fishing & mining|industries that produce a finished, usable product or are involved in construction|service sector, as opposed to raw materials & manufacturing|administrative division in several countries|2D or 3D defined space on something, mainly in terrestrial and astrophysics sciences|currency of most countries in the European Union","null,null,null,https://upload.wikimedia.org/wikipedia/commons/a/ac/The_woman_making_a_carpet_and_watching_TV_series.jpg,https://upload.wikimedia.org/wikipedia/commons/c/c6/US_Navy_030515-N-5862D-038_U.S._Navy_recruits_get_their_first_military_haircuts_at_the_Navy_Exchange_barbershop.jpg,https://upload.wikimedia.org/wikipedia/commons/9/97/Map_of_country_subdivisions_%28provinces%29.svg,https://upload.wikimedia.org/wikipedia/commons/7/7d/Mediterranian_Sea_Carthago_location.JPG,https://upload.wikimedia.org/wikipedia/commons/6/65/Euro_coins_and_banknotes.jpg","null,null,null,null,null,null,null,null"
Tourism,The total number of bed places (BPs) in tourist accommodations/year in the LAU (Local Administrative Unit) is 101. The regional (Region) share of total BPs/year is unspecified. The number of agricultural holdings in the LAU is unspecified. The nearest settlement with population over 100000 (km) is 55.358. In this region protected areas are present.,"Lau Islands, Hotel room, Tourism, Local Administrative Unit, Region, Agricultural holding, Settlement, Population, Protected area","http://www.wikidata.org/entity/Q1062438, http://www.wikidata.org/entity/Q27686, http://www.wikidata.org/entity/Q49389, http://www.wikidata.org/entity/Q193083, http://www.wikidata.org/entity/Q82794, http://www.wikidata.org/entity/Q131596, http://www.wikidata.org/entity/Q1247845, http://www.wikidata.org/entity/Q175385, http://www.wikidata.org/entity/Q473972","archipelago of Fiji|business enterprise that provides indoor lodging in a single location paid on a short-term basis|travel for pleasure or business|geocode standard for referencing the subdivisions of countries for statistical purposes|2D or 3D defined space on something, mainly in terrestrial and astrophysics sciences|area of land for farming, or, for aquaculture, lake, river or sea, including various structures|Wikimedia disambiguation page|Wikimedia disambiguation page|areas protected for having ecological or cultural importance","https://upload.wikimedia.org/wikipedia/commons/6/6b/Lau_Islands_Yagasa_highres_STS098.jpg,https://upload.wikimedia.org/wikipedia/commons/9/98/PNY_Exterior_with_Rolls_Royce.jpg,https://upload.wikimedia.org/wikipedia/commons/b/b9/Tourism.png,null,https://upload.wikimedia.org/wikipedia/commons/7/7d/Mediterranian_Sea_Carthago_location.JPG,https://upload.wikimedia.org/wikipedia/commons/7/70/Borgboda2006_web.jpg,null,null,https://upload.wikimedia.org/wikipedia/commons/d/df/%D0%A1%D1%82%D1%96%D0%BB%D1%8C%D1%81%D1%8C%D0%BA%D0%B5_%D0%93%D0%BE%D1%80%D0%BE%D0%B4%D0%B8%D1%89%D0%B5%2C_%D0%B2%D0%B8%D0%B3%D0%BB%D1%8F%D0%B4_%D0%B7_%D0%B2%D1%83%D0%BB._%D0%97%D0%B0%D1%80%D1%96%D1%87%D0%BD%D0%BE%D1%97_2.jpg","-17.833333333333 178.66666666667,null,null,null,null,null,null,null,null"
Employment,The primary sector share of total employment/year [Province] is 1.46%. The secondary sector share of total employment/year [Province] is 23.33%. The tertiary sector share of total employment/year [Province] is 75.22%. The primary sector share of total employment/year [Region] is unspecified. The secondary sector share of total employment/year [Region] is unspecified. The tertiary sector share of total employment/year [Region] is unspecified.,"Primary sector of the economy, Secondary sector of the economy, Tertiary sector of the economy, Employment, Province, Region","http://www.wikidata.org/entity/Q55640, http://www.wikidata.org/entity/Q55639, http://www.wikidata.org/entity/Q55638, http://www.wikidata.org/entity/Q656365, http://www.wikidata.org/entity/Q34876, http://www.wikidata.org/entity/Q82794","includes farming, fishing & mining|industries that produce a finished, usable product or are involved in construction|service sector, as opposed to raw materials & manufacturing|gainful occupation|administrative division in several countries|2D or 3D defined space on something, mainly in terrestrial and astrophysics sciences","null,https://upload.wikimedia.org/wikipedia/commons/a/ac/The_woman_making_a_carpet_and_watching_TV_series.jpg,https://upload.wikimedia.org/wikipedia/commons/c/c6/US_Navy_030515-N-5862D-038_U.S._Navy_recruits_get_their_first_military_haircuts_at_the_Navy_Exchange_barbershop.jpg,https://upload.wikimedia.org/wikipedia/commons/5/59/Government_employment_as_%25_of_total_employment_in_EU.jpg,https://upload.wikimedia.org/wikipedia/commons/9/97/Map_of_country_subdivisions_%28provinces%29.svg,https://upload.wikimedia.org/wikipedia/commons/7/7d/Mediterranian_Sea_Carthago_location.JPG","null,null,null,null,null,null"
Interest on this VC,"This is an autochthonous goat breed with public ownership. The herd is owned by the municipality of El Boalo. The herd grazes in the natural mountain pastures of the region, generating numerous ecological benefits, specially in relation to fire prevention. The ownership of the herd is quite special, being the municipality who is in charge of the expenses and also the management of the whole activity. In addition, adding value to this traditional activity with the School of Sheperds and the touristic packages is an innovation in the value chain of small-scale goat production.","El Boalo, Goat, Municipality, Shepherd, Tourism, Value chain, Production","http://www.wikidata.org/entity/Q1772163, http://www.wikidata.org/entity/Q2934, http://www.wikidata.org/entity/Q15284, http://www.wikidata.org/entity/Q81710, http://www.wikidata.org/entity/Q49389, http://www.wikidata.org/entity/Q646107, http://www.wikidata.org/entity/Q663143","municipality in the Community of Madrid, Spain|domesticated mammal raised for its meat and milk|administrative division having corporate status and usually powers of self-government or jurisdiction|person who tends, feeds, or guards flocks of sheep|travel for pleasure or business|functions of a company affecting its costs and quality and give it a competitive advantage|Wikimedia disambiguation page","https://upload.wikimedia.org/wikipedia/commons/a/ac/Ayuntamiento_de_El_Boalo.jpg,https://upload.wikimedia.org/wikipedia/commons/8/88/Billy_goat.jpg,null,https://upload.wikimedia.org/wikipedia/commons/5/58/Rumunia_5806.jpg,https://upload.wikimedia.org/wikipedia/commons/b/b9/Tourism.png,null,null","40.71888888888889 -3.9205555555555556,null,null,null,null,null,null"
Challenges,"1) Abandonment of traditional practices and jobs (sheperd) due to societal and structural changes (demography, modern life style, global markets, competitivity, etc.); 2)Economic profitability; 3) Conflicts with livestock producers in getting access to natural resources (those producers consider the herd as a recreative activity and less important than their meat bussinessess); 4) Finding an interested group of people that may take care of the herd. Overall the type of challenge faced by this VC is Current. This VC is classified as Traditional and Innovative.","Abandonment, Tradition, Employment, Social change, Structural change, Demography, Lifestyle, Globalization, Competition, Profit, Conflict, Livestock, Natural resource, Venture capital, Innovation","http://www.wikidata.org/entity/Q397584, http://www.wikidata.org/entity/Q82821, http://www.wikidata.org/entity/Q656365, http://www.wikidata.org/entity/Q1510761, http://www.wikidata.org/entity/Q1969120, http://www.wikidata.org/entity/Q37732, http://www.wikidata.org/entity/Q32090, http://www.wikidata.org/entity/Q7181, http://www.wikidata.org/entity/Q476300, http://www.wikidata.org/entity/Q2112047, http://www.wikidata.org/entity/Q400889, http://www.wikidata.org/entity/Q103459, http://www.wikidata.org/entity/Q188460, http://www.wikidata.org/entity/Q219409, http://www.wikidata.org/entity/Q174165","Wikimedia disambiguation page|custom passed down through generations|gainful occupation|any significant alteration in societal order|in economics, a shift in the way a market operates|science that deals with populations and their structures statistically and theoretically|interests, opinions, behaviours, and behavioural orientations of an individual, group, or culture|process of international integration arising from world views, products, ideas, and other aspects of culture|rivalry where multiple parties strive for a goal which cannot be shared|Wikimedia disambiguation page|Wikimedia disambiguation page|domesticated animals raised in an agricultural setting to produce commodities such as food, fiber and labor|naturally occurring resource, including mineral resources (e.g. metal ores), mined fossil fuels (e.g. petroleum), water resources (e.g. lakes and groundwater), water energy resources, timber, arable land, game (e.g. deer), fish in water bodies, etc.|form of private equity financing that is provided by venture capital firms or funds to startups, early-stage, and emerging companies that have been deemed to have high growth potential or demonstrated high growth|application of better solutions that meet new requirements, inarticulated needs, or existing market needs","null,https://upload.wikimedia.org/wikipedia/commons/4/47/Dreschen_mit_Flegel.jpg,https://upload.wikimedia.org/wikipedia/commons/5/59/Government_employment_as_%25_of_total_employment_in_EU.jpg,null,null,https://upload.wikimedia.org/wikipedia/commons/e/e4/Social_Network_Diagram_%28segment%29.svg,https://upload.wikimedia.org/wikipedia/commons/e/ec/Anjuna_hippie_market_01.JPG,null,https://upload.wikimedia.org/wikipedia/commons/2/2f/Formula_one.jpg,null,null,https://upload.wikimedia.org/wikipedia/commons/9/9a/Edward_Hicks_001.jpg,https://upload.wikimedia.org/wikipedia/commons/b/b0/Tussen_Twist_en_Nieuw_Schoonebeek%2C_Alte_en_Neue_Energie_foto5_2016-09-25_14.29.jpg,null,null","null,null,null,null,null,null,null,null,null,null,null,null,null,null,null"
Innovation,"The type of innovation of this VC (Value Chain) is Endogenous. Extensive grazing is not an innovative practice, but the public character of this herd, owned by the municipality, is an innovative governance system. However, due to complications in the management and conflicts with some neighbours and other producers, they are currently looking for interested people to take care of the herd. In addition, this activity is used to develop the School of Sheperds that take place every year with this herd. Finally, the herd is a touristic asset with the initiative 'Sheperd the goat' launched by the municipality of El Boalo. The innovation is related to New governance systems. The land use systems involved are Grassland. The local assets include Natural and cultural.","El Boalo, Venture capital, Endogenous growth theory, Grazing, Municipality, Shepherd, Governance, Grassland, Nature, Culture","http://www.wikidata.org/entity/Q1772163, http://www.wikidata.org/entity/Q219409, http://www.wikidata.org/entity/Q576355, http://www.wikidata.org/entity/Q3239189, http://www.wikidata.org/entity/Q15284, http://www.wikidata.org/entity/Q81710, http://www.wikidata.org/entity/Q1553864, http://www.wikidata.org/entity/Q1006733, http://www.wikidata.org/entity/Q7860, http://www.wikidata.org/entity/Q11042","municipality in the Community of Madrid, Spain|form of private equity financing that is provided by venture capital firms or funds to startups, early-stage, and emerging companies that have been deemed to have high growth potential or demonstrated high growth|theory that economic growth is mainly due to endogenous (not external) forces|method of feeding in which a herbivore eats parts of low-growing grasses, forbs or algae|administrative division having corporate status and usually powers of self-government or jurisdiction|person who tends, feeds, or guards flocks of sheep|all of the processes of governing, whether undertaken by a government, market or network, whether over a family, tribe, formal or informal organization or territory and whether through the laws, norms, power or language of an organized society|area with vegetation dominated by grasses|natural, physical, or material world and its phenomena|shared aspects of a society's way of life","https://upload.wikimedia.org/wikipedia/commons/a/ac/Ayuntamiento_de_El_Boalo.jpg,null,null,https://upload.wikimedia.org/wikipedia/commons/7/76/Grazend_Bees.jpg,null,https://upload.wikimedia.org/wikipedia/commons/5/58/Rumunia_5806.jpg,null,https://upload.wikimedia.org/wikipedia/commons/9/9e/Chile_%283%29%2C_Patagonia%2C_Road_Y-50_towards_Rio_Verde.JPG,https://upload.wikimedia.org/wikipedia/commons/9/94/Desert_Electric.jpg,https://upload.wikimedia.org/wikipedia/commons/8/82/Nwodua_wulana_Alhassan.jpg","40.71888888888889 -3.9205555555555556,null,null,null,null,null,null,null,null,null"
