title,description,objects,objectlinks,wikidata_descriptions,wikidata_images,wikidata_coords
La Troje seeds,"The MOVING reference member state of this VC (Value Chain) is SPAIN UCO. The reference MOVING Card ID of this VC is VC 41 ES. The cooperative La Troje is the main actor but cannot be seen isolated from the network in which they operate (from residents of the area to other organisations, research insitutions and municipalities). Their impact on the social-ecological-system comes with the promotion and use of local varieties that enhance the knowledge on local food production and they are normally less dependent on external inputs (as they are adapted to local conditions), making the systrem more resilient.","Spain, Value chain, Municipality, Heirloom seed, Food production, Resilience","http://www.wikidata.org/entity/Q29, http://www.wikidata.org/entity/Q646107, http://www.wikidata.org/entity/Q15284, http://www.wikidata.org/entity/Q5700975, http://www.wikidata.org/entity/Q540912, http://www.wikidata.org/entity/Q527605",country in southwestern Europe with territories in Africa|functions of a company affecting its costs and quality and give it a competitive advantage|administrative division having corporate status and usually powers of self-government or jurisdiction|cultivar grown during earlier periods of human history|type of industry; collective of diverse businesses that supplies much of the world's food|Wikimedia disambiguation page,"https://upload.wikimedia.org/wikipedia/commons/d/d3/Spain_-_Location_Map_%282013%29_-_ESP_-_UNOCHA.svg,null,null,https://upload.wikimedia.org/wikipedia/commons/5/57/Heirloom_tomatoes_2.jpg,https://upload.wikimedia.org/wikipedia/commons/2/25/%D0%9C%D0%BB%D0%B5%D0%BA%D0%B0%D1%80%D0%BD%D0%B8%D1%86%D0%B0_%E2%80%9E%D0%9E%D1%81%D0%BE%D0%B3%D0%BE%D0%B2%D0%BE_%D0%9C%D0%B8%D0%BB%D0%BA%E2%80%9C_22.jpg,null","40.2 -3.5,null,null,null,null,null"
Mountain landscape and reference chains,"The reference mountain chain of this VC is Sierra del Guadarrama. The reference mountain landscape of this VC is El Berrueco. Located in the Northern Sierra, its main activity in the past was used to be related to livestock (being grazed in the open forests 'dehesas' of oaks and ash trees). Within the MRL there is a part of the water reservoir of el Atazar that is visited by many citizens from the area and Madrid city during summer to enjoy a bath.","El Berrueco, El Atazar, Madrid, Sierra de Guadarrama, Livestock, Oak, Ash tree","http://www.wikidata.org/entity/Q645201, http://www.wikidata.org/entity/Q1772153, http://www.wikidata.org/entity/Q2807, http://www.wikidata.org/entity/Q53711, http://www.wikidata.org/entity/Q103459, http://www.wikidata.org/entity/Q12004, http://www.wikidata.org/entity/Q128887","municipality of Spain|human settlement in Spain|capital of Spain|Central System mountain range, in the center of the Iberian Peninsula|domesticated animals raised in an agricultural setting to produce commodities such as food, fiber and labor|genus of plants|genus of plants","https://upload.wikimedia.org/wikipedia/commons/a/ae/Vista_a%C3%A9rea_de_El_Berrueco.jpg,https://upload.wikimedia.org/wikipedia/commons/8/81/El_Atazar_2601.jpg,https://upload.wikimedia.org/wikipedia/commons/c/ce/Madrid_%2838624991251%29.jpg,https://upload.wikimedia.org/wikipedia/commons/b/be/Viajando_%2891445844%29_%28color%2C_contrast%29.jpg,https://upload.wikimedia.org/wikipedia/commons/9/9a/Edward_Hicks_001.jpg,https://upload.wikimedia.org/wikipedia/commons/a/af/Quercus_robur.jpg,https://upload.wikimedia.org/wikipedia/commons/4/4f/Fraxinus_excelsior.jpg","40.88805555555555 -3.5605555555555557,40.934444444444445 -3.4719444444444445,40.41694444444445 -3.703333333333333,40.850139 -3.956231,null,null,null"
Geography and population,The size of the area (km2) is 28.43. The minimum altimetry of the LAU (Local Administrative Unit) is 830. The maximum altimetry of the LAU is 1164. The total population (in thousand) is unspecified. The population density (Inhabitants/km2) in the LAU is 27.33. The population change rate of the LAU in the last 10 years (%) has been 28.42%. The overall regional population density (Inhabitants/km2) is unspecified. The regional population change rate in the last 10 years (%) is unspecified.,"Lau Islands, Square kilometre, Altitude, Local Administrative Unit, Population, Population density, Region","http://www.wikidata.org/entity/Q1062438, http://www.wikidata.org/entity/Q712226, http://www.wikidata.org/entity/Q190200, http://www.wikidata.org/entity/Q193083, http://www.wikidata.org/entity/Q175385, http://www.wikidata.org/entity/Q22856, http://www.wikidata.org/entity/Q82794","archipelago of Fiji|decimal multiple of the SI unit of surface area|height in relation to a certain reference point|geocode standard for referencing the subdivisions of countries for statistical purposes|Wikimedia disambiguation page|measurement of population per unit area or unit volume|2D or 3D defined space on something, mainly in terrestrial and astrophysics sciences","https://upload.wikimedia.org/wikipedia/commons/6/6b/Lau_Islands_Yagasa_highres_STS098.jpg,https://upload.wikimedia.org/wikipedia/commons/1/19/1_km2.svg,https://upload.wikimedia.org/wikipedia/commons/9/9f/Altitude_marker%2C_Lismore.jpg,null,null,https://upload.wikimedia.org/wikipedia/commons/4/4d/World_population_density_map.PNG,https://upload.wikimedia.org/wikipedia/commons/7/7d/Mediterranian_Sea_Carthago_location.JPG","-17.833333333333 178.66666666667,null,null,null,null,null,null"
Income and gross value added,The average per capita income (EUR/year) [Province] is 14858.07. The total Gross Value Added (GVA) (EUR million/year) [Province] is 0.018458. The primary sector share of total GVA/year [Province] is 0.25%. The secondary sector share of total GVA/year [Province] is 25.93%. The tertiary sector share of total GVA/year [Province] is 73.82%. The per capita income (EUR/year) [Region] is unspecified. The total Gross Value Added (GVA) (EUR million/year) [Region] is unspecified. The primary sector share of total GVA/year [Region] is unspecified. The secondary sector share of total GVA/year [Region] is unspecified. The tertiary sector share of total GVA/year [Region] is unspecified.,"Per capita income, Gross value added, Primary sector, Secondary sector, Tertiary sector, Euro, Province, Region","http://www.wikidata.org/entity/Q45918, http://www.wikidata.org/entity/Q994873, http://www.wikidata.org/entity/Q55640, http://www.wikidata.org/entity/Q55639, http://www.wikidata.org/entity/Q55638, http://www.wikidata.org/entity/Q4916, http://www.wikidata.org/entity/Q34876, http://www.wikidata.org/entity/Q82794","average income of an economy|economic indicator which adjusts gross domestic product (GDP) by the impact of subsidies and taxes (tariffs) on products|includes farming, fishing & mining|industries that produce a finished, usable product or are involved in construction|service sector, as opposed to raw materials & manufacturing|currency of most countries in the European Union|administrative division in several countries|2D or 3D defined space on something, mainly in terrestrial and astrophysics sciences","null,null,null,https://upload.wikimedia.org/wikipedia/commons/a/ac/The_woman_making_a_carpet_and_watching_TV_series.jpg,https://upload.wikimedia.org/wikipedia/commons/c/c6/US_Navy_030515-N-5862D-038_U.S._Navy_recruits_get_their_first_military_haircuts_at_the_Navy_Exchange_barbershop.jpg,https://upload.wikimedia.org/wikipedia/commons/6/65/Euro_coins_and_banknotes.jpg,https://upload.wikimedia.org/wikipedia/commons/9/97/Map_of_country_subdivisions_%28provinces%29.svg,https://upload.wikimedia.org/wikipedia/commons/7/7d/Mediterranian_Sea_Carthago_location.JPG","null,null,null,null,null,null,null,null"
Tourism,The total number of bed places (BPs) in tourist accommodations/year in the LAU (Local Administrative Unit) is 539. The regional (Region) share of total BPs/year is unspecified. The number of agricultural holdings in the LAU is unspecified. The nearest settlement with population over 100000 (km) is 66.347. In this region protected areas are present.,"Lau Islands, Hotel room, Tourism, Local Administrative Unit, Region, Agricultural holding, Settlement, Population, Protected area","http://www.wikidata.org/entity/Q1062438, http://www.wikidata.org/entity/Q27686, http://www.wikidata.org/entity/Q49389, http://www.wikidata.org/entity/Q193083, http://www.wikidata.org/entity/Q82794, http://www.wikidata.org/entity/Q131596, http://www.wikidata.org/entity/Q1247845, http://www.wikidata.org/entity/Q175385, http://www.wikidata.org/entity/Q473972","archipelago of Fiji|business enterprise that provides indoor lodging in a single location paid on a short-term basis|travel for pleasure or business|geocode standard for referencing the subdivisions of countries for statistical purposes|2D or 3D defined space on something, mainly in terrestrial and astrophysics sciences|area of land for farming, or, for aquaculture, lake, river or sea, including various structures|Wikimedia disambiguation page|Wikimedia disambiguation page|areas protected for having ecological or cultural importance","https://upload.wikimedia.org/wikipedia/commons/6/6b/Lau_Islands_Yagasa_highres_STS098.jpg,https://upload.wikimedia.org/wikipedia/commons/9/98/PNY_Exterior_with_Rolls_Royce.jpg,https://upload.wikimedia.org/wikipedia/commons/b/b9/Tourism.png,null,https://upload.wikimedia.org/wikipedia/commons/7/7d/Mediterranian_Sea_Carthago_location.JPG,https://upload.wikimedia.org/wikipedia/commons/7/70/Borgboda2006_web.jpg,null,null,https://upload.wikimedia.org/wikipedia/commons/d/df/%D0%A1%D1%82%D1%96%D0%BB%D1%8C%D1%81%D1%8C%D0%BA%D0%B5_%D0%93%D0%BE%D1%80%D0%BE%D0%B4%D0%B8%D1%89%D0%B5%2C_%D0%B2%D0%B8%D0%B3%D0%BB%D1%8F%D0%B4_%D0%B7_%D0%B2%D1%83%D0%BB._%D0%97%D0%B0%D1%80%D1%96%D1%87%D0%BD%D0%BE%D1%97_2.jpg","-17.833333333333 178.66666666667,null,null,null,null,null,null,null,null"
Employment,The primary sector share of total employment/year [Province] is 0.66%. The secondary sector share of total employment/year [Province] is 25.00%. The tertiary sector share of total employment/year [Province] is 75.00%. The primary sector share of total employment/year [Region] is unspecified. The secondary sector share of total employment/year [Region] is unspecified. The tertiary sector share of total employment/year [Region] is unspecified.,"Primary sector of the economy, Secondary sector of the economy, Tertiary sector of the economy, Employment, Province, Region","http://www.wikidata.org/entity/Q55640, http://www.wikidata.org/entity/Q55639, http://www.wikidata.org/entity/Q55638, http://www.wikidata.org/entity/Q656365, http://www.wikidata.org/entity/Q34876, http://www.wikidata.org/entity/Q82794","includes farming, fishing & mining|industries that produce a finished, usable product or are involved in construction|service sector, as opposed to raw materials & manufacturing|gainful occupation|administrative division in several countries|2D or 3D defined space on something, mainly in terrestrial and astrophysics sciences","null,https://upload.wikimedia.org/wikipedia/commons/a/ac/The_woman_making_a_carpet_and_watching_TV_series.jpg,https://upload.wikimedia.org/wikipedia/commons/c/c6/US_Navy_030515-N-5862D-038_U.S._Navy_recruits_get_their_first_military_haircuts_at_the_Navy_Exchange_barbershop.jpg,https://upload.wikimedia.org/wikipedia/commons/5/59/Government_employment_as_%25_of_total_employment_in_EU.jpg,https://upload.wikimedia.org/wikipedia/commons/9/97/Map_of_country_subdivisions_%28provinces%29.svg,https://upload.wikimedia.org/wikipedia/commons/7/7d/Mediterranian_Sea_Carthago_location.JPG","null,null,null,null,null,null"
Interest on this VC,"1) Production and reproduction of local varieties of seeds. These seeds are the result of multiple generations of farmers using these varieties along the mountain range; 2) Breeding of endogenous vegetables and fruit trees; 3) All the activities are carried out under the framework of agroecology; 4) Local economies. This association is innovative in terms of their approach to the activity. Not only they produce seeds and plants but foster a change in the agricultural system towards one that is more equal, fair and sustainable. The innovation comes then with their holistic approach to the sector (working on seeds, plants, compost or gardening) and with their parallel activities in research, education and activism.","Seed, Farmer, Vegetable, Fruit tree, Agroecology, Local economy, Agriculture, Compost, Gardening, Research, Education, Activism","http://www.wikidata.org/entity/Q40763, http://www.wikidata.org/entity/Q131512, http://www.wikidata.org/entity/Q11004, http://www.wikidata.org/entity/Q904653, http://www.wikidata.org/entity/Q396338, http://www.wikidata.org/entity/Q159810, http://www.wikidata.org/entity/Q11451, http://www.wikidata.org/entity/Q212254, http://www.wikidata.org/entity/Q124946, http://www.wikidata.org/entity/Q42240, http://www.wikidata.org/entity/Q8434, http://www.wikidata.org/entity/Q203764","embryonic plant enclosed in a protective outer covering (seed coat)|person engaged in agriculture, raising living organisms for food or raw materials|edible plant or part of a plant, involved in cooking|tree which bears fruit that is consumed or used by humans and some animals|study of ecological processes in agriculture|area of the production, distribution and trade, as well as consumption of goods and services by different agents|cultivation of plants and animals to provide useful products|rich, moist soil composted from food scraps|practice of growing and cultivating plants|systematic study undertaken to increase knowledge|transmission of knowledge and skills|efforts to make change in society toward a perceived greater good","https://upload.wikimedia.org/wikipedia/commons/d/dc/%D0%A0%D0%B0%D0%B7%D0%BD%D0%BE%D0%BE%D0%B1%D1%80%D0%B0%D0%B7%D0%B8%D0%B5_%D1%81%D0%B5%D0%BC%D1%8F%D0%BD.jpg,https://upload.wikimedia.org/wikipedia/commons/a/a2/04-09-12-Schaupfl%C3%BCgen-Fahrenwalde-RalfR-IMG_1232.jpg,https://upload.wikimedia.org/wikipedia/commons/f/fe/Kleinmarkthalle_Frankfurt_Gem%C3%BCsestand.jpg,https://upload.wikimedia.org/wikipedia/commons/b/be/%D0%A9%D0%B5%D0%B4%D1%80%D0%BE_%D0%B2%D1%80%D0%BE%D0%B4%D0%B8%D0%BB%D0%B0_%D0%B0%D0%B1%D1%80%D0%B8%D0%BA%D0%BE%D1%81%D0%B0_%D0%B4%D0%B8%D1%87%D0%BA%D0%B0.jpg,https://upload.wikimedia.org/wikipedia/commons/c/c3/Agribusiness_vs_agroecology.jpg,https://upload.wikimedia.org/wikipedia/commons/f/fa/Grand-Bazaar_Shop.jpg,https://upload.wikimedia.org/wikipedia/commons/7/76/Unload_wheat_by_the_combine_Claas_Lexion_584.jpg,https://upload.wikimedia.org/wikipedia/commons/8/86/Compost_pile.JPG,https://upload.wikimedia.org/wikipedia/commons/f/f7/Matauk_i_kj%C3%B8kkenhagen.jpg,https://upload.wikimedia.org/wikipedia/commons/8/86/Mitarbeiterin_der_EMPA_in_St-Gallen.jpg,https://upload.wikimedia.org/wikipedia/commons/5/57/1887_Bettannier_Der_Schwarze_Fleck_anagoria.jpg,https://upload.wikimedia.org/wikipedia/commons/7/7a/Greenpeacebelomonte.jpg","null,null,null,null,null,null,null,null,null,null,null,null"
Challenges,1) The loss of endemic vaireties that cannot be retrieved anymore; 2) The climate change causing rapid changes in the local conditions that may hamper the efficacy of these seeds; 3) The policies that regulate the seed trade and production; 4) The access to markets and the dominance of comercial varieties of seeds; 5) The change on diets that leave aside many traditional vegetables and do not attend to seasonality. Overall the type of challenge faced by this VC is Current. This VC is classified as Traditional and Innovative.,"Endemism, Climate change, Commercial crop, Traditional food, Seasonality","http://www.wikidata.org/entity/Q123452, http://www.wikidata.org/entity/Q125928, http://www.wikidata.org/entity/Q932139, http://www.wikidata.org/entity/Q19708506, http://www.wikidata.org/entity/Q2111082",ecological state of being unique to a defined geographic location or habitat|human-caused changes to climate on Earth|agricultural crop grown to sell for profit|foods and dishes that are passed on through generations|presence of variations that occur at specific regular intervals less than a year,"https://upload.wikimedia.org/wikipedia/commons/7/79/Dronte_17th_Century_color_corrected.jpg,https://upload.wikimedia.org/wikipedia/commons/1/11/Carbon_Dioxide_800kyr.svg,https://upload.wikimedia.org/wikipedia/commons/b/b7/USPS_Drop_Box_in_Start_Louisiana.jpg,https://upload.wikimedia.org/wikipedia/commons/5/58/Historic_Food_Festival_in_Biskupin_Poland.jpg,null","null,null,null,null,null"
Innovation,"The type of innovation of this VC (Value Chain) is Endogenous. Plant breeding is not an innovative activity nor are the varieties or techniques that they are using. However, the innovation comes with the multidisciplinarity of this association. They breed local varieties in collaboration with local experts, putting in value the local and traditional ecological knowledge. In addition, they give courses on various topics related to gardening (from seedling to composting). They distribute their own products to keep the direct relationship with the consumers or they sell at small stores that share their principles. They are a cooperative that works to build regional networks of agroecology. The innovation is related to the whole VC. The land use systems involved are Cropland. The local assets include Natural, social and cultural.","Value chain, Endogenous growth theory, Plant breeding, Agroecology, Cropland, Nature, Social science, Culture","http://www.wikidata.org/entity/Q646107, http://www.wikidata.org/entity/Q576355, http://www.wikidata.org/entity/Q788558, http://www.wikidata.org/entity/Q396338, http://www.wikidata.org/entity/Q3395383, http://www.wikidata.org/entity/Q7860, http://www.wikidata.org/entity/Q34749, http://www.wikidata.org/entity/Q11042","functions of a company affecting its costs and quality and give it a competitive advantage|theory that economic growth is mainly due to endogenous (not external) forces|the art and science of changing the traits of plants in order to produce desired characteristics|study of ecological processes in agriculture|land used for agricultural purposes|natural, physical, or material world and its phenomena|academic disciplines concerned with society and the relationships between individuals in society|shared aspects of a society's way of life","null,null,https://upload.wikimedia.org/wikipedia/commons/2/29/Wheat_selection_k10183-1.jpg,https://upload.wikimedia.org/wikipedia/commons/c/c3/Agribusiness_vs_agroecology.jpg,https://upload.wikimedia.org/wikipedia/commons/3/39/Hoeve_Groot_Amelgem%2C_Wolvertem_05.jpg,https://upload.wikimedia.org/wikipedia/commons/9/94/Desert_Electric.jpg,https://upload.wikimedia.org/wikipedia/commons/e/e4/Social_Network_Diagram_%28segment%29.svg,https://upload.wikimedia.org/wikipedia/commons/8/82/Nwodua_wulana_Alhassan.jpg","null,null,null,null,null,null,null,null"
